speaker_id,speeches,party_id,party_name,county,orientation,sex,x0,x1,cluster,speeches_cleaned
#MireiaBorrásPabón,Come on President Good afternoon ladies and gentlemen Today a terrorist group comes to tell us that it wants to narrow the digital divide in the attention to citizens Sounds like a joke does n't it Bildu worried about narrowing gaps when they were born precisely to open them In particular to open irreparable gaps in the broken heart of all the families of the victims who have to endure how this unscrupulous government whites and favors terrorists who mercilessly murdered their loved ones It is simply foolish that they intend to make us believe in this motion that the political arm of ETA cares about the well being of the citizenry when reason,#party.Vox,Vox,ES,#orientation.RRF,F,23.409704,5.6734467,5,come president good afternoon ladies gentlemen today terrorist group comes tell us wants narrow digital divide attention citizens sounds like joke n't bildu worried narrowing gaps born precisely open particular open irreparable gaps broken heart families victims endure unscrupulous government whites favors terrorists mercilessly murdered loved ones simply foolish intend make us believe motion political arm eta cares well citizenry reason
#RodrigoJiménezRevuelta,With all due respect Madam President Ladies and gentlemen good morning Minister dear Carmen and other guests today we are debating the adoption of the emerging business bill better known as startups During its parliamentary procedure quite a number of amendments have been incorporated although none by the way of this parliamentary group but some of the other groups that shared the same purpose as those tabled by VOX The first amendment tabled by this parliamentary group concerned the elimination within the explanatory statement of the law of the inclusion once again of the so called gender gap which is nothing more than an ideological term which the left uses as a mantra in a supposed defence of women to whom however ladies and gentlemen they do not defend indeed a term used by Mr Píriz in his speech in the Commission stating that one in five entrepreneurs are women Ladies and gentlemen of the People 's Party you will never change Then it bothers them when we tell them that they are part of the consensus progress but it is that they always buy the speech on the left because I ask them whether there is any impediment to women being entrepreneurial because of their sex as Mr Píriz said in the Commission or if on the contrary what exists is lack of support for women who are mothers and who have more difficulties in reconciling their family life Ladies and gentlemen what exists in Spain today is the maternal gap There is no wage difference because of being a woman what exists is discrimination because of having children What should be done is to reward the hiring of parents in businesses and the protection of the family If you do not believe me I refer you to the report by the Banco de España whose conclusions are devastating I warned that the maternity pay gap was 28 Under no circumstances is the word gender mentioned a term by the way used sibilically by the left to criminalize man And to subscribe the statements of Olivia 's father my dear friend Eugenio to whom I was able to accompany this Tuesday in Segovia to fire his murdered daughter allegedly at the hands of her mother manifesting listen well your lordships that this is not of men and women but of good and bad The feminist perspective must disappear from any legal text and from our lives forever Only by the inclusion of ideological terms would this bill deserve our disapproval But it is no less true that the sector is quite satisfied with the bill and we must acknowledge that the text of the law has been improved albeit not sufficiently This is mainly due to the method used by the Government vetoing 57 of the 271 amendments tabled using a totalitarian approach and without any legal basis Firstly because amendments affecting the decrease in income and a generic concept are being vetoed without determining exactly what heading such an amendment would be concerned with And in addition it is being done on the future benefit when it should be the current benefit because the decrease in budgetary revenue is not a fact that is likely to be certain but a fact of probability Secondly because there is a distortion of the very raison d'être of the power of the veto of the Government recognized in article 134.6 of the Spanish Constitution since the aforementioned power of the Government is exercised as it is exercised in the proceedings has to be examined by the Chamber And there is lewdness on the part of the groups in accepting the vetoes undermining the legislative powers of the Congress so that this recently executed practice by the Government is preventing the parliamentary groups from carrying out their functions as has happened in the paper and in the Commission And thirdly because there is no precedent in the history of this House for vetoing amendments that affect the decline in income when it is also an estimate As the Government has raised an additional 28 billion up to September by breaking its forecasts there is no point in vetoing amendments that affect a tax such as for example the IRPF because because of the elasticity of this tax the application of a deduction in the IRPF may result in higher collection and higher revenues This practice must be denounced as another element of this Government which manages the institutions at its own discretion Ladies and gentlemen tell me what is the point then of parliamentary groups submitting amendments Is n't it logical with a startup law to introduce amendments that affect tax laws And if they do is n't it logical that they can lower income Also on the contrary it may happen that a deduction for example in IRPF increases them Do you ladies and gentlemen agree to apply a practice that can be used by future governments I have already told you that this parliamentary group will initiate the necessary legal measures to determine whether or not the veto on the amendments is in line with the law Ladies and gentlemen it turns out that some of the vetoed amendments proposed an ostensible improvement of the law including increasing from five to seven or from seven to twelve if they are biotechnological the years to be considered startups increasing the base of deduction in IRPF for investment in startups from EUR 100 000 to EUR 1 million increasing the limit of own funds to be considered startups from EUR 400 000 to EUR 1 million increasing for example the three to five year period for the application of the 15 tax rate on company tax on startups or reducing the tax on certain digital services from 3 to 1.5 to taxpayers in Ceuta and Melilla In total the budgetary impact of the above mentioned amendments which the Government vetoed amounts to EUR 128 million i.e. almost EUR 130 million the same amount that Mr Sánchez has promised to give to the Bill and Melinda Gates Foundation behind the back of the Spanish and less than the more than EUR 150 million that has been reserved for the Presidency of Europe Ladies and gentlemen it is an unprecedented act of hypocrisy and phariseeism by a government that vetoes illegal amendments amendments that could have improved this law for entrepreneurs SMEs self employed people and investors For Sánchez 's wishes there is no money to help them but there is money for his whims and delusions of power when it comes to promoting himself and who knows if perhaps also preparing for his departure Ladies and gentlemen when we govern we will repeal all ideological laws on the first day and return to the Spaniards the place they deserve and should never lose Thank you so much,#party.Vox,Vox,ES,#orientation.RRF,M,23.497175,15.017247,5,due respect madam president ladies gentlemen good morning minister dear carmen guests today debating adoption emerging business bill better known startups parliamentary procedure quite number amendments incorporated although none way parliamentary group groups shared purpose tabled vox first amendment tabled parliamentary group concerned elimination within explanatory statement law inclusion called gender gap nothing ideological term left uses mantra supposed defence women however ladies gentlemen defend indeed term used mr píriz speech commission stating one five entrepreneurs women ladies gentlemen people 's party never change bothers tell part consensus progress always buy speech left ask whether impediment women entrepreneurial sex mr píriz said commission contrary exists lack support women mothers difficulties reconciling family life ladies gentlemen exists spain today maternal gap wage difference woman exists discrimination children done reward hiring parents businesses protection family believe refer report banco de españa whose conclusions devastating warned maternity pay gap 28 circumstances word gender mentioned term way used sibilically left criminalize man subscribe statements olivia 's father dear friend eugenio able accompany tuesday segovia fire murdered daughter allegedly hands mother manifesting listen well lordships men women good bad feminist perspective must disappear legal text lives forever inclusion ideological terms would bill deserve disapproval less true sector quite satisfied bill must acknowledge text law improved albeit sufficiently mainly due method used government vetoing 57 271 amendments tabled using totalitarian approach without legal basis firstly amendments affecting decrease income generic concept vetoed without determining exactly heading amendment would concerned addition done future benefit current benefit decrease budgetary revenue fact likely certain fact probability secondly distortion raison d'être power veto government recognized article 134.6 spanish constitution since aforementioned power government exercised exercised proceedings examined chamber lewdness part groups accepting vetoes undermining legislative powers congress recently executed practice government preventing parliamentary groups carrying functions happened paper commission thirdly precedent history house vetoing amendments affect decline income also estimate government raised additional 28 billion september breaking forecasts point vetoing amendments affect tax example irpf elasticity tax application deduction irpf may result higher collection higher revenues practice must denounced another element government manages institutions discretion ladies gentlemen tell point parliamentary groups submitting amendments n't logical startup law introduce amendments affect tax laws n't logical lower income also contrary may happen deduction example irpf increases ladies gentlemen agree apply practice used future governments already told parliamentary group initiate necessary legal measures determine whether veto amendments line law ladies gentlemen turns vetoed amendments proposed ostensible improvement law including increasing five seven seven twelve biotechnological years considered startups increasing base deduction irpf investment startups eur 100 000 eur 1 million increasing limit funds considered startups eur 400 000 eur 1 million increasing example three five year period application 15 tax rate company tax startups reducing tax certain digital services 3 1.5 taxpayers ceuta melilla total budgetary impact mentioned amendments government vetoed amounts eur 128 million i.e. almost eur 130 million amount mr sánchez promised give bill melinda gates foundation behind back spanish less eur 150 million reserved presidency europe ladies gentlemen unprecedented act hypocrisy phariseeism government vetoes illegal amendments amendments could improved law entrepreneurs smes self employed people investors sánchez 's wishes money help money whims delusions power comes promoting knows perhaps also preparing departure ladies gentlemen govern repeal ideological laws first day return spaniards place deserve never lose thank much
#RocíoDeMeerMéndez,How it is noted that when there are no arguments there are the usual insults those we are already used to receiving in this House Ladies and gentlemen you and you have been doing this all morning tell the Spaniards that you have to pay taxes to make organ transplants to pay for chemotherapy sessions in public health and logically who is going to oppose it But the reality the reality is that you are going to spend four times the budget of the Ministry of Health and more than twice the budget of the Ministry of Defence on an ideological plan that you have called the Strategic Plan for Effective Equality between Women and Men It is indecent Minister that you are going to allocate 20 319 million euros that you will then make up and say it is to improve people 's lives I will tell you some phrases of your strategic plan and the intentions of your ministry creating an advisory table of ecofeminism integrating the gender perspective of course into absolutely everything The document is full of General budgets of the State with a gender perspective General administration of the State with a gender perspective regulations with a gender perspective European Social Fund with a gender perspective contracts with a gender perspective But do n't miss it which you also want to fight against the feminization of poverty in a country where 82 of sinogarism is male At the same time you want to involve the media in overcoming gender stereotypes but you also advocate measures to eradicate I do n't know what symbolic violence and cultural violence against women you also want to transform the mandate of hegemonic masculinity and you want to create a feminist library do CIS surveys for women and post feminist degrees And do n't miss it I do n't know what it will be push the observatory for the image of women Minister thousands of Spaniards that 's why it 's indecent can't pay for the light can't take a plate to their homes can't heat their families have to close the shutters of their businesses and the doors of their trucks forever to stay without anything so that you spend your tax money to pay feminism that neither eats nor heats nor serves for anything Thank you so much,#party.Vox,Vox,ES,#orientation.RRF,F,24.75569,15.468575,5,noted arguments usual insults already used receiving house ladies gentlemen morning tell spaniards pay taxes make organ transplants pay chemotherapy sessions public health logically going oppose reality reality going spend four times budget ministry health twice budget ministry defence ideological plan called strategic plan effective equality women men indecent minister going allocate 20 319 million euros make say improve people 's lives tell phrases strategic plan intentions ministry creating advisory table ecofeminism integrating gender perspective course absolutely everything document full general budgets state gender perspective general administration state gender perspective regulations gender perspective european social fund gender perspective contracts gender perspective n't miss also want fight feminization poverty country 82 sinogarism male time want involve media overcoming gender stereotypes also advocate measures eradicate n't know symbolic violence cultural violence women also want transform mandate hegemonic masculinity want create feminist library cis surveys women post feminist degrees n't miss n't know push observatory image women minister thousands spaniards 's 's indecent can't pay light can't take plate homes can't heat families close shutters businesses doors trucks forever stay without anything spend tax money pay feminism neither eats heats serves anything thank much
#JuanLuisSteegmannOlmedillas,"With venial Mr. President Good afternoon ladies and gentlemen Today we are presented for our consideration with a proposal for a law that was registered by the People 's Parliamentary Group last March The proposed law has five pages with the explanatory statement sixteen articles four additional provisions one transitional and one final entry into force In addition it has an unfortunate name it is called a bill on violence in the health field It is unfortunate because the People 's Parliamentary Group in its explanatory statement says that the problem that is to be solved is a cause and I quote textually in which health professionals are especially exposed to aggression and situations of violence and that it is an occupational danger that must be prevented and avoided Therefore this proposal for a law should have been called a proposal for a law on violence against health personnel not only because this name does describe the object of the proposal but because it comes out of the fraudulent and tortuous use made by the left of the term violence We know that the left uses in its propaganda the National Socialist principle of transposition whose name in German I do n't remember for example accusing the victim of having the intention to attack the murderer We see every day in this House how the crimes are justified and how the friends of convicts pander before us For the communist all he opposes to his ends is violence Ladies and gentlemen of the Group of the European People 's Party you should already know that because you have been abusing yourselves for decades So you should be careful to use such ambiguous names since the left makes continuous incursions in this area to give the message that health professionals exercise for example violence against women Although from a laughable point of view it is not innocent that Mrs Calvo insinuated that doctors in the 1970s arbitrarily removed the vesicle and of course of course not Francois From the most sinister bank the extreme left insists on denouncing the concept of obstetric violence for example a concept illuminated in the matrix of Bolivarian communism and whose false implant in the collective imagination has been denounced by the College Medical Organization and by this modest doctor I do it here for the simple reason ladies and gentlemen that at least in Spain this is an infamous slander Gentlemen of Podemos ladies of Podemos go to the countries whose name religion is submission and you will see there first hand what gynecological violence is starting with genital mutilation Therefore let 's focus on violence against health personnel because we find worrying data since in 2021 according to a ministry report 1.57 out of every 100 professionals suffered it There were 10,170 assaults and that most verbal assaults are not reported following the 2015 reform Let us illuminate yes with our focus the violence against health personnel because it is increasing and let us know the context in which it occurs Why did most of the assaults occur in primary care Why is 90 of the attacks occurring in the public and only 10 in the private sector Let us therefore look at the context let us improve the mediocre report of the Ministry of Health let us support the College Medical Organization which has made it possible for violence against doctors to be declared an attack on authority and denounce the lack of diligence of the Ministry of the Interior and the Ministry of Health which have made Instruction 1/2017 undeveloped Is there reason for the Spanish to be dissatisfied with health carelessness A lot VOX has denounced it from this rostrum when we were presented with the infumable Darias law But there is not a single one to attack the healthcare staff none at all And it 's intolerable for them to be slandered Moreover this violence against health workers has been protected here by saying that there are objective elements that justify it starting with Mr de Bildu How No no party without Aunt Joan ladies and gentlemen here in the house for example we hope that the vocation of service and devotion to the law will make the lawyers live up to the very grave moment that we live in But we do n't expect that from the health care providers no we do n't we do n't expect them to do their duty no Why Because we know for sure that they will fulfill their duty as they have done throughout the history of Spanish health and in the epidemic And what already cries out to heaven is that here all the left wing groups have said that they will not support this bill because there are objective reasons to beat the toilets That 's intolerable That is the rulers should not continue to abuse the vocation of health professionals This abuse has been reflected in the fact that all color governments have made Spanish doctors the worst paid in Europe To begin with politicians need to know what they are and for example some community president would have to know for God 's sake that looks are not students they are doctors And of course to dignify working conditions is an essential step That is the message that politicians and these General Courts must give approving at least the consideration of this initiative We will support the consideration of this bill because we believe it can minimize aggression against health personnel and we hope to be able to make amendments to the process For starters I would ask you to change the name and save us an amendment Thank you very much",#party.Vox,Vox,ES,#orientation.RRF,M,18.417587,12.4586,5,"venial mr. president good afternoon ladies gentlemen today presented consideration proposal law registered people 's parliamentary group last march proposed law five pages explanatory statement sixteen articles four additional provisions one transitional one final entry force addition unfortunate name called bill violence health field unfortunate people 's parliamentary group explanatory statement says problem solved cause quote textually health professionals especially exposed aggression situations violence occupational danger must prevented avoided therefore proposal law called proposal law violence health personnel name describe object proposal comes fraudulent tortuous use made left term violence know left uses propaganda national socialist principle transposition whose name german n't remember example accusing victim intention attack murderer see every day house crimes justified friends convicts pander us communist opposes ends violence ladies gentlemen group european people 's party already know abusing decades careful use ambiguous names since left makes continuous incursions area give message health professionals exercise example violence women although laughable point view innocent mrs calvo insinuated doctors 1970s arbitrarily removed vesicle course course francois sinister bank extreme left insists denouncing concept obstetric violence example concept illuminated matrix bolivarian communism whose false implant collective imagination denounced college medical organization modest doctor simple reason ladies gentlemen least spain infamous slander gentlemen podemos ladies podemos go countries whose name religion submission see first hand gynecological violence starting genital mutilation therefore let 's focus violence health personnel find worrying data since 2021 according ministry report 1.57 every 100 professionals suffered 10,170 assaults verbal assaults reported following 2015 reform let us illuminate yes focus violence health personnel increasing let us know context occurs assaults occur primary care 90 attacks occurring public 10 private sector let us therefore look context let us improve mediocre report ministry health let us support college medical organization made possible violence doctors declared attack authority denounce lack diligence ministry interior ministry health made instruction 1/2017 undeveloped reason spanish dissatisfied health carelessness lot vox denounced rostrum presented infumable darias law single one attack healthcare staff none 's intolerable slandered moreover violence health workers protected saying objective elements justify starting mr de bildu party without aunt joan ladies gentlemen house example hope vocation service devotion law make lawyers live grave moment live n't expect health care providers n't n't expect duty know sure fulfill duty done throughout history spanish health epidemic already cries heaven left wing groups said support bill objective reasons beat toilets 's intolerable rulers continue abuse vocation health professionals abuse reflected fact color governments made spanish doctors worst paid europe begin politicians need know example community president would know god 's sake looks students doctors course dignify working conditions essential step message politicians general courts must give approving least consideration initiative support consideration bill believe minimize aggression health personnel hope able make amendments process starters would ask change name save us amendment thank much"
