speaker_id,speeches,party_id,party_name,county,orientation,sex,x0,x1,cluster,speeches_cleaned
#PabloJuanCalvoListe,Thank you President Ladies and gentlemen the draft Law on Contaminated Wastes and Soils and for a Circular Economy arises on the occasion of two directives of the European Union but with such a subject in the hands of this eco-fanatic government which is dedicated to demolishing thermal power plants in order to achieve a radical model that is neither more sustainable nor sovereign nor effective and that involves the destruction of our productive capacity and dependence on foreign powers with the approval of the People 's Party which has already closed the Garoña power plant nothing new could be expected both kneeling before the climate gurus of the moment and condemning the Spanish to energy poverty The fork that allowed transposition was broad but a text with 118 articles emerged which no longer liked anyone as evidenced by the large number of amendments tabled 1321 742 in Congress and 579 in the Senate And dealt with in the worst possible way with haste and last minute compromise amendments something that we are already very accustomed to A text full of ideology that does not substantially improve the amendments and that has already provoked our vote against this House and the veto in the Senate Not only do we pay more for energy for its insane climate we also pay more for getting rid of waste and all thanks to Brussels radical environmental policy Greta and foreign globalist agendas which bring us to ruin and misery As we said yesterday or green demagogy or the future of our children The result is another project that emerged from the 2030 factory and its SDGs objectives of social demolition characterized by increased state run driving more laborious and above all more tax And it is that Brussels and Sánchez create a single use rate on plastic packaging another on landfill waste storage and another on waste incineration which already apply ten autonomous communities These taxes do not serve to prevent or reduce they only seek to collect Already the Council of State 's opinion on the draft law warned precisely of the risk that these new burdens could entail an insurmountable cost for many of the economic operators In addition in case there is little the Socialist Group is submitting two amendments amending the Water Act to recover the hydroelectric fee that the electricity companies will pay The PP already did it in 2015 but wrong which forced the Supreme Court to request the return of 1908 million euros You know who 's gonna pay for this hydroelectric cannon do n't you Do n't you know I tell you each and every one of the Spaniards Economic growth will be sluggish by reducing competitiveness for businesses and harming market and entrepreneurship freedom which will eventually impact on the pocket of all families We will say it again the best residue is the one that is not generated But in the project prevention is little more than a declaration of intent without serious control mechanisms although it does establish a sanctioning regime For you prevention is to interfere in the productive models of companies by fixing which products have to be withdrawn or which ones have to be put back on the market In VOX we believe that the opposite is true it is necessary to allow the R D i departments to know how to innovate the best materials that are free of toxics and packaging prepared for the 100 recovery technology zero waste and other viable initiatives with patents and competition in the market With a progressive language that floods the whole text as a society of recycling resilience or co-governance the true intention is hidden which is nothing other than the growth of an already existing artificial waste market multiplying bureaucratic bodies from the general budgets Its longing circular economy is also not defined The only thing that circulates in the project is the money for subsidies taxes and taxes collected by the State in each phase of the recycling process The autonomous communities will have discretion in the authorizations one more step in the bankruptcy of the market unit and in the inequality between Spaniards The European Union wants to harmonise each and every criterion However what you want and what you are committed to is to develop seventeen taifas markets It is not understood that the same material has different consideration in one region of Spain or another Nor is energy recovery by incineration of non-hazardous waste envisaged more than in the last place and with prohibitive taxation when it is rapid clean within the limits of the European Union and which makes it possible to transform energy into electricity evaporative heat But they do n't like it because it's not part of the artificial and sustained business of their chiringuitos We see positive the reduction of methane emissions from landfills or farms for their transformation into biogas without criminalising farmers In twenty five years we will have an avalanche of solar panels rich in cadmium lead heavy metals to have to recycle them panels produced entirely in China the largest source of CO2 in the world All this is done to the greatest glory of the government with the European Green Pact from whose sources this project drinks but leaving a poisoned legacy to future generations Of course we must save the planet but we must save it from all of you Nothing more Thank you very much,#party.Vox,Vox,ES,#orientation.RRF,M,42.896385,-4.7786703,34,thank president ladies gentlemen draft law contaminated wastes soils circular economy arises occasion two directives european union subject hands eco-fanatic government dedicated demolishing thermal power plants order achieve radical model neither sustainable sovereign effective involves destruction productive capacity dependence foreign powers approval people 's party already closed garoña power plant nothing new could expected kneeling climate gurus moment condemning spanish energy poverty fork allowed transposition broad text 118 articles emerged longer liked anyone evidenced large number amendments tabled 1321 742 congress 579 senate dealt worst possible way haste last minute compromise amendments something already accustomed text full ideology substantially improve amendments already provoked vote house veto senate pay energy insane climate also pay getting rid waste thanks brussels radical environmental policy greta foreign globalist agendas bring us ruin misery said yesterday green demagogy future children result another project emerged 2030 factory sdgs objectives social demolition characterized increased state run driving laborious tax brussels sánchez create single use rate plastic packaging another landfill waste storage another waste incineration already apply ten autonomous communities taxes serve prevent reduce seek collect already council state 's opinion draft law warned precisely risk new burdens could entail insurmountable cost many economic operators addition case little socialist group submitting two amendments amending water act recover hydroelectric fee electricity companies pay pp already 2015 wrong forced supreme court request return 1908 million euros know 's gonna pay hydroelectric cannon n't n't know tell every one spaniards economic growth sluggish reducing competitiveness businesses harming market entrepreneurship freedom eventually impact pocket families say best residue one generated project prevention little declaration intent without serious control mechanisms although establish sanctioning regime prevention interfere productive models companies fixing products withdrawn ones put back market vox believe opposite true necessary allow r departments know innovate best materials free toxics packaging prepared 100 recovery technology zero waste viable initiatives patents competition market progressive language floods whole text society recycling resilience co-governance true intention hidden nothing growth already existing artificial waste market multiplying bureaucratic bodies general budgets longing circular economy also defined thing circulates project money subsidies taxes taxes collected state phase recycling process autonomous communities discretion authorizations one step bankruptcy market unit inequality spaniards european union wants harmonise every criterion however want committed develop seventeen taifas markets understood material different consideration one region spain another energy recovery incineration non-hazardous waste envisaged last place prohibitive taxation rapid clean within limits european union makes possible transform energy electricity evaporative heat n't like part artificial sustained business chiringuitos see positive reduction methane emissions landfills farms transformation biogas without criminalising farmers twenty five years avalanche solar panels rich cadmium lead heavy metals recycle panels produced entirely china largest source co2 world done greatest glory government european green pact whose sources project drinks leaving poisoned legacy future generations course must save planet must save nothing thank much
#SantiagoAbascalConde,Good morning Let 's go to the real problems of the Spaniards Mr Sánchez what measures will your Government take to put an end to the energy dependence that impoverishes Spain and that is ruining the Spanish Because we have the feeling that your government your party and your partners have lost contact with the street that they are not in the markets in the neighborhoods in the bars Because if they were they'd know that people do n't care about digital ethic citizenship color zebra steps gender based mathematics People are worried about access to housing having a stable job being able to form a family and being able to pay the bill for electricity and gas Mr Sánchez The Spaniards are sick of losing purchasing power of living worse than other generations of living worse than their parents and you only offer misery and despair when you should offer certainties Since 2020 with you inflation has risen by 6 electricity has risen by 46 butane by 47 gasoline by 23 diesel by 25 Spain has lost its energy sovereignty with you at the head of the government and you will say it is a global problem but there are different ways to captivate the temporal In Germany you have put your money on gas in France you are going to build fourteen nuclear reactors the European Union which you always obey now it seems not has just declared green gas and nuclear energy and other countries to which you are so critical like Poland have ended up with VAT so that families can pay the electricity and gas bill You bet on a decrement model and frivolities in the meantime Its model is the deindustrialization of the interior Spain the criminalization of diesel and the manufacture of vehicles in Spain the blasting of thermal power plants such as Velilla del Río Carrión in Palencia the closure of nuclear power plants such as the Garoña nuclear power plant and the gift of gas which is needed for the Spanish families to the satrap of Morocco That is their model is business that closes because they can't even lift the blind and families that can't warm up in winter because they can't pay the energy bill Their energy transition is a thyme that shows once again that when communists and socialists are in power families suffer the humble suffer the popular classes suffer and the middle classes suffer,#party.Vox,Vox,ES,#orientation.RRF,M,45.480206,0.096775725,34,good morning let 's go real problems spaniards mr sánchez measures government take put end energy dependence impoverishes spain ruining spanish feeling government party partners lost contact street markets neighborhoods bars they'd know people n't care digital ethic citizenship color zebra steps gender based mathematics people worried access housing stable job able form family able pay bill electricity gas mr sánchez spaniards sick losing purchasing power living worse generations living worse parents offer misery despair offer certainties since 2020 inflation risen 6 electricity risen 46 butane 47 gasoline 23 diesel 25 spain lost energy sovereignty head government say global problem different ways captivate temporal germany put money gas france going build fourteen nuclear reactors european union always obey seems declared green gas nuclear energy countries critical like poland ended vat families pay electricity gas bill bet decrement model frivolities meantime model deindustrialization interior spain criminalization diesel manufacture vehicles spain blasting thermal power plants velilla del río carrión palencia closure nuclear power plants garoña nuclear power plant gift gas needed spanish families satrap morocco model business closes can't even lift blind families can't warm winter can't pay energy bill energy transition thyme shows communists socialists power families suffer humble suffer popular classes suffer middle classes suffer
#SantiagoAbascalConde,Mr Sánchez unlike out there in this Parliament we are three hundred and fifty privileged Get out on the street do n't travel around the world that much Get on the street if you can talk to the self employed stop at a road bar walk through a market visit an industrial site There are millions of Spaniards out there who are suffering who can't pay the bill for the light who can't turn on the heating who can't fill the deposit who can't even pay the quota of self employed people all this long before the criminal and illegitimate war of Mr Putin and in Spain in a more serious way than in the countries of our environment much more serious Stop being the indispensable where no one misses him We already know that you have managed to take a photo with your Canadian photocopy that Mr. Macron is very fond of you that Mr. Biden grants you thirty seconds looking at the clock but what have you and what are you doing for the Spanish who are suffering Absolutely nothing crumbs and lies When we talked to you about energy sovereignty in the motion of censure we presented against you they laughed at us They have also laughed at producers farmers and farmers who have been talking about unfair competition for a long time They have criminalized diesel criminalized nuclear energy criminalized fracking devoted themselves to the blasting of thermal power plants and imposed the green fundamentalism that is leading to the ruin of the middle classes and the most disadvantaged people in Spain You are responsible for Spain 's and Europe 's food industrial and energy dependence but in Europe you have reacted and you remain immobile Do something change course radically as they have done elsewhere Temporaryly remove or urgently and radically reduce taxes on essential goods rather than cash do so also with gas with gasoline do so with light Do everything the Spaniards are waiting for you to do Close Mrs. Montero's insulting ministry Use that 20 billion euros that Mrs Montero wants to use in the sex war to help the most needy families or to guarantee energy sovereignty Mr. Sánchez cut in political spending cut to parties unions or employers Do it now or leave because your government Mr Sánchez is a factory of misery just like your ideology,#party.Vox,Vox,ES,#orientation.RRF,M,44.899582,2.0680847,34,mr sánchez unlike parliament three hundred fifty privileged get street n't travel around world much get street talk self employed stop road bar walk market visit industrial site millions spaniards suffering can't pay bill light can't turn heating can't fill deposit can't even pay quota self employed people long criminal illegitimate war mr putin spain serious way countries environment much serious stop indispensable one misses already know managed take photo canadian photocopy mr. macron fond mr. biden grants thirty seconds looking clock spanish suffering absolutely nothing crumbs lies talked energy sovereignty motion censure presented laughed us also laughed producers farmers farmers talking unfair competition long time criminalized diesel criminalized nuclear energy criminalized fracking devoted blasting thermal power plants imposed green fundamentalism leading ruin middle classes disadvantaged people spain responsible spain 's europe 's food industrial energy dependence europe reacted remain immobile something change course radically done elsewhere temporaryly remove urgently radically reduce taxes essential goods rather cash also gas gasoline light everything spaniards waiting close mrs. montero's insulting ministry use 20 billion euros mrs montero wants use sex war help needy families guarantee energy sovereignty mr. sánchez cut political spending cut parties unions employers leave government mr sánchez factory misery like ideology
#SantiagoAbascalConde,Mr. Sanchez good morning This is going to be the hardest winter in decades for the Spaniards Families are gripped by the loss of purchasing power Inflation on commodities is out of the question The fiscal pressure you hold against the Spaniards is abusive and unfair The house is a luxury for more and more Spaniards Young people think about forming a family but that 's a chimera Light and gas are directly remunerable for low rents but also for middle rents The Spanish have become poorer over these five years more than the rest of the Europeans and that has happened to you in Moncloa That is why we have come to tell you that today you have to explain all those who for example have made propaganda against nuclear power plants those who shut down the financed Garoña nuclear power plant those who have bet on the blasting of thermal power plants and those who have held it on the boards of the electricity companies Those who like you have given up on foreign policy as a whimsical autocrat causing among other things the drop in the import of Algerian gas and the import of Russian gas right now in addition to a new migratory invasion But above all the honourable Members who in this House have supported a climate law that prohibits the Spanish from exploring and exploiting their own energy resources condemning them to energy dependence as a nation and to energy poverty as a Spaniard You try to ridicule the nuclear solution by saying it's for a decade or two but it comes with a pin in the 2030 Agenda flap and presented us here with the 2050 Agenda for twenty five years We have the Spain Agenda for today the Spain Agenda for now This Government can now decide to reopen the Garoña nuclear power plant This government can stop the blasting of thermal power plants and this Parliament can vote tomorrow for the repeal of climate law which is suicide for the Spanish Do n't listen to us ask people instead of taking pictures with people who are doing so badly Use article 92 of the Constitution and consult the Spaniards if they want to continue paying the most expensive energy or if they want to explore their own natural resources,#party.Vox,Vox,ES,#orientation.RRF,M,45.395313,0.15544483,34,mr. sanchez good morning going hardest winter decades spaniards families gripped loss purchasing power inflation commodities question fiscal pressure hold spaniards abusive unfair house luxury spaniards young people think forming family 's chimera light gas directly remunerable low rents also middle rents spanish become poorer five years rest europeans happened moncloa come tell today explain example made propaganda nuclear power plants shut financed garoña nuclear power plant bet blasting thermal power plants held boards electricity companies like given foreign policy whimsical autocrat causing among things drop import algerian gas import russian gas right addition new migratory invasion honourable members house supported climate law prohibits spanish exploring exploiting energy resources condemning energy dependence nation energy poverty spaniard try ridicule nuclear solution saying decade two comes pin 2030 agenda flap presented us 2050 agenda twenty five years spain agenda today spain agenda government decide reopen garoña nuclear power plant government stop blasting thermal power plants parliament vote tomorrow repeal climate law suicide spanish n't listen us ask people instead taking pictures people badly use article 92 constitution consult spaniards want continue paying expensive energy want explore natural resources
#SantiagoAbascalConde,Solve your democratic and legitimate crisis and ask the Spaniards if they want to continue consuming Algerian gas Putin gas French nuclear energy and dirty energy from Morocco or if they want to explore Spain 's own energy Okay Very good is n't it,#party.Vox,Vox,ES,#orientation.RRF,M,44.50742,-0.0984314,34,solve democratic legitimate crisis ask spaniards want continue consuming algerian gas putin gas french nuclear energy dirty energy morocco want explore spain 's energy okay good n't
