speaker_id,speeches,party_id,party_name,county,orientation,sex,x0,x1,cluster,speeches_cleaned
#CasolatiMarzia,"Mr President ladies and gentlemen Minister we are here because Parliament felt that it was urgent for you to come and report on a further matter from which there is a clear criticism of your work Minister you are well aware that we in the League have never done and we will not give discounts to anyone when it comes to security and public order when the work of the law enforcement forces is in some way called into question The first analysis we need to do to approach the issue in a constructive and unobtrusive way is that what we all saw should not have happened Madam Minister you are called to coordinate the prefectures to organize the management of public order with foresight you are called to assess the risks of situations that can become explosive and to immediately understand how the safety of demonstrators must be protected avoiding violent fringes being able to infiltrate and work from within in order to achieve objectives that have nothing to do with peaceful social claims rightly brought to the streets Let us not allow bad management to be the tool for attacking women and men of the Forces of Order in the accomplishment of their work It is clear that in the management of the event in Turin which had also been authorized as a static garrison things did not work in the right way it was allowed that violent fringes of anarchist insurrectionalism and belonging to the social centers have infiltrated among the students It is obvious that all this has been programmed and organized over time from what emerges from the images these movements were well inserted within the event and had organized in the smallest details the methods of provocation to arrive at the clash The mobile team called to manage the public order of the event immediately understood the danger of what was happening and how it could degenerate if it had not intervened in time to contain the protesters Preventing certain phenomena from happening requires careful guidance and intelligence that needs to be structured and structured well After the well known events of Rome culminated in the violent aggression of the headquarters of the CGIL we would have expected a careful assessment of the risks of the Turin event also because in Turin we have the professionals of the clash antagonists with multiple and multi-annual experiences of attack to the Forces of the order matured mostly in Val Susa but not only Senator Fattori I can't see now anything but provocative agents Askatasuna could not miss the appointment of Piazza Arbarello never miss an opportunity to attack the institutions physically it was a situation too gluttony Of course she showed up with sticks bricks and other blunt objects that they have launched at the appropriate time to trigger the police reaction The guarantee of the security of the citizens and the management of public order are obtained with the daily work means to understand train and train the men and women of the Forces of the Order to equip them with the right means to evaluate which are the most suitable means of defence and above all to monitor and repress the environments where violence against the State nests Since we have assumed the responsibility of Government as a League we have felt the duty to be at the side of the Forces of Order to guarantee them maximum dignity in the performance of their duties we have worked to strengthen their staff and to acquire new endowments that facilitate their tasks such as taser and bodycam Let us not deal with what has happened superficially please ladies and gentlemen You all know how deeply our country has been wounded by ideological clashes by partisan wars by red and black terrorism When one trivializes referring to what happened talking about demonstrations of students one forgets how the dark pages of the political opposition that resulted in terrorism and violence were written just starting from student movements Today marks the anniversary of the death of a young boy Paolo Di Nella it was February 9 1983 the last act of that horrible season of the years of lead when a young student was beaten by violent fringes armed by partisan hatred Let us be careful when we empty the contents of what happened in Turin let us be careful to criminalize the Forces of Order It only takes a little to make a spark turn into a fire We at the League are responsible be it clear If a cop is wrong he has to pay like anyone else The facts will be deepened the images will be reviewed we will have to understand in detail what happened This must be done absolutely quickly Young students and their parents who have found themselves unconsciously in a high risk situation must have answers must be able to know what mistakes and especially by whom they have been committed Minister believe me we are aware of the historical period we are going through We understand how difficult it is to ensure compliance with the rules and how difficult it is to stem violent demonstrations burning under the ashes of the restrictions and suspensions of constitutionally guaranteed freedoms due to the management of the extraordinary and unprecedented event of the pandemic Minister believe me when I tell you that for these reasons security and public order must be a priority for the government We cannot allow events like that which happened on Sunday evening in Milan 's Wall always in Turin where dozens of Senegalese celebrating the victory of the African Cup attacked a patrol car forcing it to escape One of the main problems is precisely the total lack of fear and respect for uniforms and the almost total certainty of impunity for those who care spit or attack the guardians of order Mr. Minister as a League we will be watching over your actions and we will try to direct you to the best of our ability because we are not interested in exploitations at the moment We do not want to capitalize on mistakes an easy political consensus we are in the government because we want to contribute to the good of our country and also to that of those who for 1,600 euros per month endanger their lives every day to ensure the safety of all people",#group.L-SP,Lega-Salvini Premier,IT,#orientation.RRF,F,17.83644,9.48775,5,"mr president ladies gentlemen minister parliament felt urgent come report matter clear criticism work minister well aware league never done give discounts anyone comes security public order work law enforcement forces way called question first analysis need approach issue constructive unobtrusive way saw happened madam minister called coordinate prefectures organize management public order foresight called assess risks situations become explosive immediately understand safety demonstrators must protected avoiding violent fringes able infiltrate work within order achieve objectives nothing peaceful social claims rightly brought streets let us allow bad management tool attacking women men forces order accomplishment work clear management event turin also authorized static garrison things work right way allowed violent fringes anarchist insurrectionalism belonging social centers infiltrated among students obvious programmed organized time emerges images movements well inserted within event organized smallest details methods provocation arrive clash mobile team called manage public order event immediately understood danger happening could degenerate intervened time contain protesters preventing certain phenomena happening requires careful guidance intelligence needs structured structured well well known events rome culminated violent aggression headquarters cgil would expected careful assessment risks turin event also turin professionals clash antagonists multiple multi-annual experiences attack forces order matured mostly val susa senator fattori can't see anything provocative agents askatasuna could miss appointment piazza arbarello never miss opportunity attack institutions physically situation gluttony course showed sticks bricks blunt objects launched appropriate time trigger police reaction guarantee security citizens management public order obtained daily work means understand train train men women forces order equip right means evaluate suitable means defence monitor repress environments violence state nests since assumed responsibility government league felt duty side forces order guarantee maximum dignity performance duties worked strengthen staff acquire new endowments facilitate tasks taser bodycam let us deal happened superficially please ladies gentlemen know deeply country wounded ideological clashes partisan wars red black terrorism one trivializes referring happened talking demonstrations students one forgets dark pages political opposition resulted terrorism violence written starting student movements today marks anniversary death young boy paolo di nella february 9 1983 last act horrible season years lead young student beaten violent fringes armed partisan hatred let us careful empty contents happened turin let us careful criminalize forces order takes little make spark turn fire league responsible clear cop wrong pay like anyone else facts deepened images reviewed understand detail happened must done absolutely quickly young students parents found unconsciously high risk situation must answers must able know mistakes especially committed minister believe aware historical period going understand difficult ensure compliance rules difficult stem violent demonstrations burning ashes restrictions suspensions constitutionally guaranteed freedoms due management extraordinary unprecedented event pandemic minister believe tell reasons security public order must priority government cannot allow events like happened sunday evening milan 's wall always turin dozens senegalese celebrating victory african cup attacked patrol car forcing escape one main problems precisely total lack fear respect uniforms almost total certainty impunity care spit attack guardians order mr. minister league watching actions try direct best ability interested exploitations moment want capitalize mistakes easy political consensus government want contribute good country also 1,600 euros per month endanger lives every day ensure safety people"
#BalboniAlberto,Mr President today we are all committed to reaffirming the commitment of the Senate and Parliament to combat violence against women an alarming phenomenon which despite the constant commitment of the institutions cannot be eradicated and unfortunately seems to be on the increase Nothing is more hateful than violence against women and I would add even against children who are sometimes victims of the violence they are witnessing Brothers of Italy shares the conclusions of the report under discussion with particular regard to the need to regulate on the basis of homogeneous standards to coordinate and above all to strengthen the centres for the treatment of men who are the perpetrators of violence centres which have so far been established in a spontaneous and leopard spotted manner on national territory The action of these centres is fundamental both for the prevention itself when the violence is still in the potential state but the so called spy behaviors that announce it are already manifested and to intervene when the violence is in place in order to prevent further degrees of escalation of violent acts and above all the cases of recurrence which as is well known and many colleagues have already mentioned are also very often the most serious episodes The available statistics show that the relapse in crimes against women is very high we are talking about 85 But we also know thanks to the many studies mentioned in the report that proper treatment especially if carried out on as voluntary a basis as possible can lead to the reduction of relapse by up to half i.e. up to 50 For this reason it is important that the treatment is also ensured during the execution of the sentence as required by the reform of the prison order approved under the so called red code But it is even more important that this treatment is not interrupted at the time of release as unfortunately happens too often It should therefore be stressed that the report rightly points out that it is precisely at the time of the return to freedom that the greater the risk to the victim is It is important to remember as the report does the good practice of the Milan court which has activated the sending of perpetrators of violence to specific territorial recovery programmes Another fundamental instrument also introduced with the code red is the new discipline of article 165 of the penal code which subordinates the granting of the conditional suspension of the sentence in cases of conviction for crimes of sexual violence stalking domestic violence and so on to the participation of the guilty person in specific recovery paths more reason in our opinion to enhance the centers that are responsible for this objective Many others would be the ideas for reflection offered by the report on which there is no time to dwell I would just like to stress that most of the Brothers of Italy agree with them and for this reason too we shall be voting in favour of the resolution which refers to the report However ladies and gentlemen in conclusion I should like to express some concerns about the apodittic statement that I quote on page 43 of the report it is precisely the patriarchal model within which individual acts of violence against women develop Attributing to the patriarchal model which in Italy no longer exists for decades the main or even exclusive cause of violence against women seems to me to be too reductive and risks underestimating if not ignoring other triggering factors much more current and insidious that originate more from the loss of every model of value reference induced by nihilism and relativism of this modernity than from a patriarchal culture now disappeared and outdated or worse still means focusing all the attention on the patriarchal model as if it were a scapegoat and ignoring the negative influence of traditions and religious beliefs outside Europe that assign to women a role yes anthropologically I would say almost biologically inferior and that produce these yes sexism and masculism as a necessary result It will mean something colleagues for example if 42 of the sexual violence in Italy is committed by foreigners who as is well known are only 10 of the population especially of North African origin or if 33 of the abuse in the family or even 71 percent of the crimes of induction and exploitation of prostitution are once again committed by foreigners Perhaps an additional reflection by the Commission on these figures would have been helpful in my opinion and in our opinion I conclude with a final critical remark in the report we read on page 24 that among the factors that would facilitate violent behavior there would be I quote the static and rigid vision of male and female gender identities I believe that this statement is not only unfounded but also misleading and the result of an ideological forcing which in this report is frankly untrue Respect for and enhancement of the male and female identity are in our opinion the most solid prerequisite on which the mutual acceptance of the natural differences between the two sexes is built to be understood as an opportunity for mutual enrichment through complementarity obviously on the basis of the absolute equality of rights and duties On the contrary it is from the claim of ignoring differences and making everything fluid homogeneous neutral and homologable which opens the way to the lack of respect for the other and to all forms of violence In any case even in the presence of these questionable elements which are fortunately marginal we agree entirely with the report and therefore we will vote in favour of it,#group.FdI,Fratelli d'Italia,IT,#orientation.RRF,M,17.699347,14.370325,5,mr president today committed reaffirming commitment senate parliament combat violence women alarming phenomenon despite constant commitment institutions cannot eradicated unfortunately seems increase nothing hateful violence women would add even children sometimes victims violence witnessing brothers italy shares conclusions report discussion particular regard need regulate basis homogeneous standards coordinate strengthen centres treatment men perpetrators violence centres far established spontaneous leopard spotted manner national territory action centres fundamental prevention violence still potential state called spy behaviors announce already manifested intervene violence place order prevent degrees escalation violent acts cases recurrence well known many colleagues already mentioned also often serious episodes available statistics show relapse crimes women high talking 85 also know thanks many studies mentioned report proper treatment especially carried voluntary basis possible lead reduction relapse half i.e. 50 reason important treatment also ensured execution sentence required reform prison order approved called red code even important treatment interrupted time release unfortunately happens often therefore stressed report rightly points precisely time return freedom greater risk victim important remember report good practice milan court activated sending perpetrators violence specific territorial recovery programmes another fundamental instrument also introduced code red new discipline article 165 penal code subordinates granting conditional suspension sentence cases conviction crimes sexual violence stalking domestic violence participation guilty person specific recovery paths reason opinion enhance centers responsible objective many others would ideas reflection offered report time dwell would like stress brothers italy agree reason shall voting favour resolution refers report however ladies gentlemen conclusion like express concerns apodittic statement quote page 43 report precisely patriarchal model within individual acts violence women develop attributing patriarchal model italy longer exists decades main even exclusive cause violence women seems reductive risks underestimating ignoring triggering factors much current insidious originate loss every model value reference induced nihilism relativism modernity patriarchal culture disappeared outdated worse still means focusing attention patriarchal model scapegoat ignoring negative influence traditions religious beliefs outside europe assign women role yes anthropologically would say almost biologically inferior produce yes sexism masculism necessary result mean something colleagues example 42 sexual violence italy committed foreigners well known 10 population especially north african origin 33 abuse family even 71 percent crimes induction exploitation prostitution committed foreigners perhaps additional reflection commission figures would helpful opinion opinion conclude final critical remark report read page 24 among factors would facilitate violent behavior would quote static rigid vision male female gender identities believe statement unfounded also misleading result ideological forcing report frankly untrue respect enhancement male female identity opinion solid prerequisite mutual acceptance natural differences two sexes built understood opportunity mutual enrichment complementarity obviously basis absolute equality rights duties contrary claim ignoring differences making everything fluid homogeneous neutral homologable opens way lack respect forms violence case even presence questionable elements fortunately marginal agree entirely report therefore vote favour
#BalboniAlberto,Madam President Madam Minister as you know very well the prison police are working in very extreme conditions Among other things today some prison police unions have called for a demonstration under the Ministry of Justice for next Wednesday April 13 to ask for measures against them Unfortunately as you know the prison police are subject to continuous assaults which no longer count and the decision to close judicial psychiatric hospitals OPG and to transfer prisoners with psychiatric problems to ordinary departments because the residences for the execution of security measures REMS are all beyond to come has aggravated the situation further Moreover the system of open cells with the so called dynamic supervision has unfortunately handed over to organised crime the control of many prisons because the staff available to supervise is insufficient in the face of prisoners who can move freely inside the prison all day long There are shortages of staff but above all the average age is increasingly advanced so many prison police officers struggle to cope with these very heavy tasks As you know Minister doctors in prisons are no longer there because health care has been transferred to ASL Many prison police officers no longer know what to do because now systematically the prisoners denounce them for torture because we have a case of torture so elastic wide and undifferentiated so it can be in everything even psychological suffering let alone in prison In such a situation you have appointed the new head of the department of the penitentiary administration DAP raising the protests of the unions but also even within the Supreme Council of the judiciary CSM because undoubtedly the profile of the new head of the DAP is more suitable for the guarantor of the prisoners than the head of the penitentiary police It is a divisive appointment unfortunately I have already mentioned this and you have answered me by inviting me to evaluate it on the ground but Minister such an appointment should be made with an ex ante judgment and not by referring to an ex post evaluation Therefore from this point of view I would ask you to know on the basis of which criteria you have made this appointment PRESIDENT The debate is The Minister for Justice Professor Cartabia has the right to reply to the question which has just been put for three minutes,#group.FdI,Fratelli d'Italia,IT,#orientation.RRF,M,20.985355,9.421775,5,madam president madam minister know well prison police working extreme conditions among things today prison police unions called demonstration ministry justice next wednesday april 13 ask measures unfortunately know prison police subject continuous assaults longer count decision close judicial psychiatric hospitals opg transfer prisoners psychiatric problems ordinary departments residences execution security measures rems beyond come aggravated situation moreover system open cells called dynamic supervision unfortunately handed organised crime control many prisons staff available supervise insufficient face prisoners move freely inside prison day long shortages staff average age increasingly advanced many prison police officers struggle cope heavy tasks know minister doctors prisons longer health care transferred asl many prison police officers longer know systematically prisoners denounce torture case torture elastic wide undifferentiated everything even psychological suffering let alone prison situation appointed new head department penitentiary administration dap raising protests unions also even within supreme council judiciary csm undoubtedly profile new head dap suitable guarantor prisoners head penitentiary police divisive appointment unfortunately already mentioned answered inviting evaluate ground minister appointment made ex ante judgment referring ex post evaluation therefore point view would ask know basis criteria made appointment president debate minister justice professor cartabia right reply question put three minutes
