speaker_id,speeches,party_id,party_name,county,orientation,sex,x0,x1,cluster,speeches_cleaned
#JoséMaríaFigaredoÁlvarezSala,Thank you very much Mr President The VOX Parliamentary Group brings a very clear very concrete initiative We only ask for ten points ten very clear concrete measures which are absolutely acceptable to anyone who reads this text from a common sense point of view These are measures which will benefit our carriers and which as I say are absolutely reasonable First meetings as soon as possible with all the representatives of the sector and take decisions in agreement with those representatives and thinking about the good of the Spanish and Spanish families very acceptable Preventing carriers from working below operating costs perfectly reasonable moreover our unfair competition rules already establish the sale at loss as a cause of infringement of the Unfair Competition Act To draw up a national energy sovereignty plan that will ultimately think about the well being of the Spaniards it has the whole meaning of the world To make a change or to urge the European authorities to change the reduced rates of VAT which can be applied precisely to the hydrocarbons used for transport this is an issue that has the whole meaning of the world To promote in turn the reduction of taxes on hydrocarbons we were talking about VAT and now we are talking about the excise duty on hydrocarbons To ask moreover that the application of this tax be suspended on a short term basis it is absolutely reasonable These are matters of absolute common sense In addition to that promote the creation and protection of safe parking for our carriers which is a traditional claim of the sector collaborate effectively so that these parkings are spread throughout the geography of Spain forget or withdraw that announcement made by the Government to establish payment systems on all roads and all high capacity highways in Spain The Government has already announced that it had in mind to establish toll systems on all motorways in Spain and we ask you to contain this measure I think it 's a matter of pure common sense there 's no oven for buns And finally to promote the immediate return of the outstanding amount of the health cent which is an issue that is pending in many administrations and at many levels in Spain These are matters of absolute common sense but when we announce these measures when we talk about these measures that have been mentioned in earlier items of the agenda discussed today the opposing parliamentary groups ridicule us I will ask the Members to keep a little silence please I am obliged to do so to the extent that the Presidency does not say anything please it is that there is no one speaking here,#party.Vox,Vox,ES,#orientation.RRF,M,41.86127,-3.5299864,34,thank much mr president vox parliamentary group brings clear concrete initiative ask ten points ten clear concrete measures absolutely acceptable anyone reads text common sense point view measures benefit carriers say absolutely reasonable first meetings soon possible representatives sector take decisions agreement representatives thinking good spanish spanish families acceptable preventing carriers working operating costs perfectly reasonable moreover unfair competition rules already establish sale loss cause infringement unfair competition act draw national energy sovereignty plan ultimately think well spaniards whole meaning world make change urge european authorities change reduced rates vat applied precisely hydrocarbons used transport issue whole meaning world promote turn reduction taxes hydrocarbons talking vat talking excise duty hydrocarbons ask moreover application tax suspended short term basis absolutely reasonable matters absolute common sense addition promote creation protection safe parking carriers traditional claim sector collaborate effectively parkings spread throughout geography spain forget withdraw announcement made government establish payment systems roads high capacity highways spain government already announced mind establish toll systems motorways spain ask contain measure think 's matter pure common sense 's oven buns finally promote immediate return outstanding amount health cent issue pending many administrations many levels spain matters absolute common sense announce measures talk measures mentioned earlier items agenda discussed today opposing parliamentary groups ridicule us ask members keep little silence please obliged extent presidency say anything please one speaking
#JoséMaríaFigaredoÁlvarezSala,I hear laughter on the socialist bench which is something that continues to impress me I do not understand how in the face of the situation that transport in Spain is suffering you are still able to laugh We have talked about the measures included in this initiative throughout the day and the parliamentary groups in this House have devoted themselves to ridiculing VOX Basically the Socialist Party comes and says to us No it 's just that you 're proposing to lower taxes as if this were where will the money come from From where You Socialists are a true example of the management of public flows and together with you the People 's Party I will give you the details because this directive the directive from which the hydrocarbon tax comes out is adopted in 2003 In 2003 for an idea to be made the diesel was at 70 cents today almost twenty years later we have the diesel at almost 2 euros That has been the result of this directive a directive which is expressly intended as it says in its explanatory statement to discourage the use of fossil fuels and hydrocarbons And you will think logically transport which is an essential element for the supply and supply of all consumers in Europe will be exempt No gentlemen transport is specifically recorded by the rules laid down in this directive This directive states that the diesel tax has to be 33 cents per litre it is a fixed one it is not a variable that today several parliamentary groups have been confused and yet the Spanish Government has set it at 38 cents per litre You 're always more papists than the pope You always go one step ahead expressing to whom The users of the diesel who will already tell me must be the rich must indeed be the most wealthy The question is that Spain needs to tighten its belt because again and I give it the dates in 2003 when this directive is adopted Spain 's external debt was EUR 400 billion And you will say this directive approves new tax rates new revenues that were not before the Spanish accounts are probably healthier since then No on the contrary the debt today is EUR 1 400 billion i.e. the debt has been multiplied by three by three despite all the additional revenue The problem is that you are disguised as doctors in economics and come here to teach us lessons It gives us lessons from the Socialist Party which I shall now speak of and it gives us lessons to Bildu to Bildu The terrorists those who have Arnaldo Otegi and David Pla the last military leader of ETA in their directive those terrorists the parliamentary group of ETA in Congress come and dare to give economic lessons and dare to talk about taxes revolutionary taxes must be of which they know And the Socialist Party comes and tells us Where are you going to get the money Socialists you are a true manifest expert in squandering public money They spent EUR 680 million on the Andalusian unemployed in a single corruption case You can get the money out of here to lower taxes,#party.Vox,Vox,ES,#orientation.RRF,M,41.11315,-3.159673,34,hear laughter socialist bench something continues impress understand face situation transport spain suffering still able laugh talked measures included initiative throughout day parliamentary groups house devoted ridiculing vox basically socialist party comes says us 's 're proposing lower taxes money come socialists true example management public flows together people 's party give details directive directive hydrocarbon tax comes adopted 2003 2003 idea made diesel 70 cents today almost twenty years later diesel almost 2 euros result directive directive expressly intended says explanatory statement discourage use fossil fuels hydrocarbons think logically transport essential element supply supply consumers europe exempt gentlemen transport specifically recorded rules laid directive directive states diesel tax 33 cents per litre fixed one variable today several parliamentary groups confused yet spanish government set 38 cents per litre 're always papists pope always go one step ahead expressing users diesel already tell must rich must indeed wealthy question spain needs tighten belt give dates 2003 directive adopted spain 's external debt eur 400 billion say directive approves new tax rates new revenues spanish accounts probably healthier since contrary debt today eur 1 400 billion i.e. debt multiplied three three despite additional revenue problem disguised doctors economics come teach us lessons gives us lessons socialist party shall speak gives us lessons bildu bildu terrorists arnaldo otegi david pla last military leader eta directive terrorists parliamentary group eta congress come dare give economic lessons dare talk taxes revolutionary taxes must know socialist party comes tells us going get money socialists true manifest expert squandering public money spent eur 680 million andalusian unemployed single corruption case get money lower taxes
#JoséMaríaFigaredoÁlvarezSala,When you Socialists look at the transporters and tell them that there is no money to make life easier for them justify what you have spent on public money and public revenues Thank you very much Your Honor,#party.Vox,Vox,ES,#orientation.RRF,M,37.563854,-3.6479876,34,socialists look transporters tell money make life easier justify spent public money public revenues thank much honor
#JoséMaríaFigaredoÁlvarezSala,"Thank you very much Madam President Today the VOX Parliamentary Group launches an urgent appeal to the Government to the Minister of Transport in particular and the question is quite simple we want to know what you are going to do it seems that the Minister has no interest in the transport sector to solve the transport crisis in Spain the transport crisis The first question to be introduced is who the carriers are In Spain there are around 200,000 trucks providing public freight services Of these 200 000 trucks 45 to 50 are operated by self employed persons yes by self employed persons While the government your government minister locked up all the Spaniards during the VID illegally by the way as the Constitutional Court has declared these autonomous these transporters continued to function and allowed all our supermarkets and all our pantry to be full complete and we had food while you had locked us up Those are the transporters these are them And it is important to underline it because at that time you applauded them They applauded them but then came the crisis of the Brexit the passage through the Channel Tunnel and there our truckers were stuck they were stuck by a diplomatic negligence of their Government precisely And his government to those whom he had previously applauded left them at the stake abandoned in the tunnel of the channel of La Mancha Then a few months later the drunken Filomena arrived and again the negligence of his government caught Spain with low guard Spain took the risk and glimpsed the risk of food shortages There we have seen a first warning of what can happen if there is indeed a shortage Well those truckers those transporters again as heroes fought for Spain and in the worst weather conditions allowed our refrigerators and pantry to remain full And you again stood idly by They 're the ones who gave the bosom do And those truckers those more than 100,000 self employed 200,000 trucks suffer serious problems that do not come from today are problems that come from far away and that have added to that cocktail machine that today we are seeing both the Socialist Party and the People 's Party because do not forget the problem of transport comes from far away And he spoke of the question of security on roads and at rest points a question due precisely to the insecurity of the citizen and the lack of funding of our forces and state security forces that both the People 's Party and the Socialist Party have been feeding for years I am talking about the logistics platforms that operate in Spain by somehow taking away this profit margin from our trucks logistic platforms that actually come from third countries from abroad in those countries operate with tax rules with social norms different from those of Spain and benefit in the end from operating in those regimes and actually billing in Spain And that system has been promoted by both the People 's Party and the Socialist Party I am of course talking about the system of module taxation and cooperatives which again take part of that margin from our carriers and which have also promoted the People 's Party and the Socialist Party that tax system which obliges our transporters Minister to live more of that tax regime than they really do from their work This very specific problem has been brewing for years and you the People 's Party and the Socialist Party have preferred to look away from the problem I hear laughs on the socialist bench it must be that the transport sector causes them hilariousness Sadly the current situation in the VOX Parliamentary Group is only causing sadness and concern Yes do n't protest if you laugh then do n't protest And the crayon of the cake the price of the fuels which have doubled their price in just a few months This issue is also being fraught with from far away because it is an obvious consequence of what its climate policies were of the People 's Party and of the Socialist Party and today we see the consequences of all the problems that you have been avoiding for many years today we see And it is that the transport sector is tired and is not able to resist even one more day because when the costs of the actual transport of a truck are around 1 euro per kilometre the current market prices are around 70 75 cents per kilometre and this is the result of all the problems that I have been listing problems that come from afar that could have been solved one by one and that has not been done Today we find the perfect storm and when the sector goes out to protest in that perfect storm the only excuse that the Minister of Transport and her Government find is that the truckers are fascists that the truckers are from VOX that Putin is very bad and that things are fatal and from there they shrug their shoulders and look back on the other side And in yesterday 's speeches on this issue tangentially representatives came out among others the representative of Podemos a gentleman who comfortably summers in San Sebastián hunts or goes to hunting farms in Burgos and Castile and then comes and tells us looking into our eyes that we have to make an effort for climate change And the problem Minister is that those who are making this effort are precisely our truckers our farmers and all those who are at the dawn of the gift of national sovereignty that the People 's Party and the Socialist Party have made over the years because they come from outside companies and sell agricultural products livestock products at half the price of the Spanish they come from outside companies and provide logistics systems or services at half the price of the Spanish they come from their climate standards and increase the price of fuels which impacts on transport impacts on agriculture impacts on fisheries and impacts on all these sectors And those who suffer the consequences of their energy climate and sovereignty policies are precisely those who work for Spain those who fight every day for Spain those who work during the Filomena storm who are stuck in the Channel Tunnel Those are the shoulders that carry with their climate policies so that then you comfortably sit in your banks quietly in your homes and in your official cars without knowing how much the price of light costs without knowing what the price of fuel is come and tell us with seemingly serious and gloomy that you have to make an effort for climate change when the effort is doing it exactly the ones below And that 's what Minister ca n't continue to happen That is why we tell them that Spain must regain its energy and food sovereignty as soon as possible We must return to the maximum possible degree of control over resources that are essential for the survival of the Spaniards",#party.Vox,Vox,ES,#orientation.RRF,M,37.97979,-1.972425,34,"thank much madam president today vox parliamentary group launches urgent appeal government minister transport particular question quite simple want know going seems minister interest transport sector solve transport crisis spain transport crisis first question introduced carriers spain around 200,000 trucks providing public freight services 200 000 trucks 45 50 operated self employed persons yes self employed persons government government minister locked spaniards vid illegally way constitutional court declared autonomous transporters continued function allowed supermarkets pantry full complete food locked us transporters important underline time applauded applauded came crisis brexit passage channel tunnel truckers stuck stuck diplomatic negligence government precisely government previously applauded left stake abandoned tunnel channel la mancha months later drunken filomena arrived negligence government caught spain low guard spain took risk glimpsed risk food shortages seen first warning happen indeed shortage well truckers transporters heroes fought spain worst weather conditions allowed refrigerators pantry remain full stood idly 're ones gave bosom truckers 100,000 self employed 200,000 trucks suffer serious problems come today problems come far away added cocktail machine today seeing socialist party people 's party forget problem transport comes far away spoke question security roads rest points question due precisely insecurity citizen lack funding forces state security forces people 's party socialist party feeding years talking logistics platforms operate spain somehow taking away profit margin trucks logistic platforms actually come third countries abroad countries operate tax rules social norms different spain benefit end operating regimes actually billing spain system promoted people 's party socialist party course talking system module taxation cooperatives take part margin carriers also promoted people 's party socialist party tax system obliges transporters minister live tax regime really work specific problem brewing years people 's party socialist party preferred look away problem hear laughs socialist bench must transport sector causes hilariousness sadly current situation vox parliamentary group causing sadness concern yes n't protest laugh n't protest crayon cake price fuels doubled price months issue also fraught far away obvious consequence climate policies people 's party socialist party today see consequences problems avoiding many years today see transport sector tired able resist even one day costs actual transport truck around 1 euro per kilometre current market prices around 70 75 cents per kilometre result problems listing problems come afar could solved one one done today find perfect storm sector goes protest perfect storm excuse minister transport government find truckers fascists truckers vox putin bad things fatal shrug shoulders look back side yesterday 's speeches issue tangentially representatives came among others representative podemos gentleman comfortably summers san sebastián hunts goes hunting farms burgos castile comes tells us looking eyes make effort climate change problem minister making effort precisely truckers farmers dawn gift national sovereignty people 's party socialist party made years come outside companies sell agricultural products livestock products half price spanish come outside companies provide logistics systems services half price spanish come climate standards increase price fuels impacts transport impacts agriculture impacts fisheries impacts sectors suffer consequences energy climate sovereignty policies precisely work spain fight every day spain work filomena storm stuck channel tunnel shoulders carry climate policies comfortably sit banks quietly homes official cars without knowing much price light costs without knowing price fuel come tell us seemingly serious gloomy make effort climate change effort exactly ones 's minister ca n't continue happen tell spain must regain energy food sovereignty soon possible must return maximum possible degree control resources essential survival spaniards"
#JoséMaríaFigaredoÁlvarezSala,"I ask the Socialist Group even if it does not like what I am saying do not interrupt me while I speak please Because you are filled with democracy but when you hear something you do n't like quickly you strike the opposite of a fascist interrupt him insult him and even throw stones at him And that is what has to stop happening because you have to look into the eyes of those who work for Spain and tell them that from now on the effort will be done by you that it will not be the shoulders of the weak who will carry with their climate dogmas That is why we repeat that Spain must return to the maximum degree of sovereignty possible And you laugh and say you want to go back to the autarchy Obviously not What we want is for the measures that are taken to be taken with common sense and for you to understand that our farmers our transporters our fishermen suffer and suffer the consequences of the decisions that you close in the offices And that if in Spain 100,000 truckers go to rest for the decisions you make it is they who will carry with that climate dogma and not you who will continue to sit comfortably in their seats who will continue to circulate in their official cars Keep interrupting",#party.Vox,Vox,ES,#orientation.RRF,M,43.5126,0.024392746,34,"ask socialist group even like saying interrupt speak please filled democracy hear something n't like quickly strike opposite fascist interrupt insult even throw stones stop happening look eyes work spain tell effort done shoulders weak carry climate dogmas repeat spain must return maximum degree sovereignty possible laugh say want go back autarchy obviously want measures taken taken common sense understand farmers transporters fishermen suffer suffer consequences decisions close offices spain 100,000 truckers go rest decisions make carry climate dogma continue sit comfortably seats continue circulate official cars keep interrupting"
