speaker_id,speeches,party_id,party_name,county,orientation,sex,x0,x1,cluster,speeches_cleaned
#FranciscoJavierOrtegaSmithMolina,Thank you very much Madam President The facts that we were able to see both in Melilla and through the explanations of the lieutenant colonel of the Civil Guard and from the vision of the different videos are as follows on 24 June there is a violent assault on the border of Spain the southern border of Europe perfectly coordinated massive and disproportionate to the number of our agents and provided in their response First an assault is not a legal entry it is not an entry allowed by a border crossing enabled for this purpose Therefore those who stress the need for attention to possible asylum applications are once again carrying out an obvious so called effect which says that any border can be assaulted by any point violently and that this gives them all kinds of rights Second it was a violent assault It was noted that once again and it is not the first Minister I myself in this rostrum presented to your ladies and gentlemen the forks before whom Members of your own party exclaimed how you are allowed to enter this Chamber with weapons axes electric radials forks sticks with sharp tips of iron and clubs all kinds of blunt material were used And he was violent also in the result fifty five officers wounded with bruises with breaks and one of them was unconscious Third it was a perfectly coordinated violent assault The image we have seen on other occasions It gives the impression that they had been instructed by military units Perfectly coordinated the advance changing successively the place of attack or assault some directing the assault others harassing the agents throwing stones throwing sticks on other occasions living lime others proceeding to the opening of the holes with radials and while some covered the front others working at the entrance and others proceeding to the massive entrance to the assault with the aim of reaching our territory In addition to coordinating the assault was absolutely massive It 's not random It is no coincidence that 2500 assailants decide to come one day at the same time and at the same point It is therefore an assault with a numerical superiority which they know perfectly well and which gives them a clear advantage over the security forces and bodies of the State which have the duty obligation and responsibility to ensure the security of all Spaniards and therefore to ensure our borders And fifth it was an absolutely disproportionate attack on the number because as I say compared to the 2500 assailants on the other side at the best of times adding to the Civil Guard the National Police and the local police there were 120 officers There were moments when we could appreciate in particular when they were breaking one of the doors as on one side on the side of Morocco there were about 1500 assailants and on the Spanish side only twelve brave agents of the Civil Guard And we defend the response of our agents once again as we have already had to defend in this very rostrum by referring to other assaults on our border and therefore assaults on our national sovereignty as we also had to defend from this rostrum their response to other assaults and attacks on our national sovereignty as was the coup d'état in Catalonia in 2017 where our agents also had to suffer that violence and that disproportionate number Mr Minister what you cannot say as Minister of the Interior is what you have just said that there were more than 120 agents and boasting about it I say there were only 120 agents in front of a brutal avalanche of 2500 violent assailants What you can't say as you just said was that there was an important deployment because there were drones a helicopter that had to leave the service to go refuel because there was no other one to support it and only 120 agents at best One of the great lies that you have given to those who hate Spain the separatists the thugs the friends of the terrorists is that they can go on saying that they had died in our territory I 'm going to tell you something that no one in this House has told you and that they probably wo n't tell you What if there were them what Is it that those of us who suffer an assault are responsible for themselves in that assault who die violent people whether our agents for saving their lives make legitimate use of force In this case there were no dead but believe me minister if there were no dead it was a miracle It was a miracle because in the face of a totally brutal avalanche they could have been killed in Spanish territory But here the dead those who appeared dead in this case yes were very alive and we could see in the images I will tell your lordships that they did not have the opportunity to see and all the Spaniards how some of those dead resurrected They had violently jumped the border and our agents tried to remove them from the accumulation of assailants By passing out they were placed on one side of the road so that the health services could come and oh surprise we all saw in the cameras how the slightest carelessness of our agents got up and ran out to CETI Those are the dead we had in our territory To all those who have accused our state security forces and forces I would like to hear them claim dead demand and denounce police violence and negligence against Morocco not our Civil Guard or our National Police The result Minister is that abandonment which you have been subjected to at the border with Spain because you tell me that there were 120 agents when as we have seen on the Moroccan side there should probably be between 500 and 600 agents Minister in an assault of 2500 illegal immigrants our forces and state security forces can say very loudly that they managed to get only six hundred to jump into Spanish territory and managed to return reject to 470 Thus of the 2500 only 130 managed to enter the territory and creanos if the Government were not theirs and ours of those 130 there was not one left right now in Spanish territory Minister I would like to end with two questions The first one of justice congratulating the forces and security forces of the State the Civil Guard the National Police and the local police of Melilla for their professionalism for their loyalty to Spain for their courage And I want to say to you Minister that you are not worthy of the magnificent agents we have in Spain That 's why you must resign And you must resign because you have abandoned them not because of the slanders that the coup groups terrorists and flounders pour against you and your Government but because you have abandoned our agents on the border with Spain Thank you very much,#party.Vox,Vox,ES,#orientation.RRF,M,32.93662,18.943804,14,thank much madam president facts able see melilla explanations lieutenant colonel civil guard vision different videos follows 24 june violent assault border spain southern border europe perfectly coordinated massive disproportionate number agents provided response first assault legal entry entry allowed border crossing enabled purpose therefore stress need attention possible asylum applications carrying obvious called effect says border assaulted point violently gives kinds rights second violent assault noted first minister rostrum presented ladies gentlemen forks members party exclaimed allowed enter chamber weapons axes electric radials forks sticks sharp tips iron clubs kinds blunt material used violent also result fifty five officers wounded bruises breaks one unconscious third perfectly coordinated violent assault image seen occasions gives impression instructed military units perfectly coordinated advance changing successively place attack assault directing assault others harassing agents throwing stones throwing sticks occasions living lime others proceeding opening holes radials covered front others working entrance others proceeding massive entrance assault aim reaching territory addition coordinating assault absolutely massive 's random coincidence 2500 assailants decide come one day time point therefore assault numerical superiority know perfectly well gives clear advantage security forces bodies state duty obligation responsibility ensure security spaniards therefore ensure borders fifth absolutely disproportionate attack number say compared 2500 assailants side best times adding civil guard national police local police 120 officers moments could appreciate particular breaking one doors one side side morocco 1500 assailants spanish side twelve brave agents civil guard defend response agents already defend rostrum referring assaults border therefore assaults national sovereignty also defend rostrum response assaults attacks national sovereignty coup d'état catalonia 2017 agents also suffer violence disproportionate number mr minister cannot say minister interior said 120 agents boasting say 120 agents front brutal avalanche 2500 violent assailants can't say said important deployment drones helicopter leave service go refuel one support 120 agents best one great lies given hate spain separatists thugs friends terrorists go saying died territory 'm going tell something one house told probably wo n't tell us suffer assault responsible assault die violent people whether agents saving lives make legitimate use force case dead believe minister dead miracle miracle face totally brutal avalanche could killed spanish territory dead appeared dead case yes alive could see images tell lordships opportunity see spaniards dead resurrected violently jumped border agents tried remove accumulation assailants passing placed one side road health services could come oh surprise saw cameras slightest carelessness agents got ran ceti dead territory accused state security forces forces would like hear claim dead demand denounce police violence negligence morocco civil guard national police result minister abandonment subjected border spain tell 120 agents seen moroccan side probably 500 600 agents minister assault 2500 illegal immigrants forces state security forces say loudly managed get six hundred jump spanish territory managed return reject 470 thus 2500 130 managed enter territory creanos government 130 one left right spanish territory minister would like end two questions first one justice congratulating forces security forces state civil guard national police local police melilla professionalism loyalty spain courage want say minister worthy magnificent agents spain 's must resign must resign abandoned slanders coup groups terrorists flounders pour government abandoned agents border spain thank much
#IgnacioGilLázaro,Thank you Madam President Minister we knew you were a bad minister but you have shown us today that as a diviner it is even worse The facts are the facts Inadequate material and human means temporary patching of troops when circumstances tighten as now inability to adequately defend our police and civilian guards because you forbid them from using anti-disturbing material and a systematic erratic policy turned into fact called are the causes of the events occurring at the southern border And the bottom line is that above all some of you allow yourselves to doubt the proven professionalism of our bodies and security forces It is intolerable that the Communist faction of the Government following the wake of certain NGOs serving the interests of the mafias demand resignation and investigation for what happened in Melilla It is absolutely intolerable it is inconceivable that you make certain statements simply trying to disguise reality to protect yourself It is inconceivable that the director general of the Civil Guard should stand in Melilla and recommend tranquillity because she says that according to her all the mechanisms of the State have worked perfectly when in just two days almost a thousand sub-Saharans have entered or that you dare to literally describe the policy with Morocco as perfect and adequate when the facts prove otherwise the police unions deny it and it is also known that in Morocco no one enters or leaves if Morocco does not want to Today there is an emergency situation on the southern border You know that it will be accentuated in the coming months and VOX already demands the deployment of our Armed Forces in defense of the southern border a policy of firmness with Morocco and the demand to NATO of the guarantee of defense of our cities of Ceuta and Melilla if that is the case That is essential as much as throwing this erratic and useless government away,#party.Vox,Vox,ES,#orientation.RRF,M,34.155556,19.89188,14,thank madam president minister knew bad minister shown us today diviner even worse facts facts inadequate material human means temporary patching troops circumstances tighten inability adequately defend police civilian guards forbid using anti-disturbing material systematic erratic policy turned fact called causes events occurring southern border bottom line allow doubt proven professionalism bodies security forces intolerable communist faction government following wake certain ngos serving interests mafias demand resignation investigation happened melilla absolutely intolerable inconceivable make certain statements simply trying disguise reality protect inconceivable director general civil guard stand melilla recommend tranquillity says according mechanisms state worked perfectly two days almost thousand sub-saharans entered dare literally describe policy morocco perfect adequate facts prove otherwise police unions deny also known morocco one enters leaves morocco want today emergency situation southern border know accentuated coming months vox already demands deployment armed forces defense southern border policy firmness morocco demand nato guarantee defense cities ceuta melilla case essential much throwing erratic useless government away
#IgnacioGilLázaro,Thank you very much Madam President We are talking today about Spanish Radio Television because it is a real scandal and it is a real scandal because this government is a real scandal because of its contempt for the laws and regulations of this House for its contempt for what this House represents for its contempt for the constitutional duty to submit to the control of representatives of national sovereignty Yesterday afternoon the Secretariat of State for Relations with the Courts sent a letter saying that it had the honour to request under Rule 188.4 of the Rules of Procedure of the Congress of Deputies the postponement of the question that we had put to the Minister of the Presidency today The Secretary of State for Relations with the Courts invokes the,#party.Vox,Vox,ES,#orientation.RRF,M,42.695282,22.461273,14,thank much madam president talking today spanish radio television real scandal real scandal government real scandal contempt laws regulations house contempt house represents contempt constitutional duty submit control representatives national sovereignty yesterday afternoon secretariat state relations courts sent letter saying honour request rule 188.4 rules procedure congress deputies postponement question put minister presidency today secretary state relations courts invokes
#IgnacioGilLázaro,The question Madam President is to denounce a trapide of this government such as those it is committing on Spanish Radio Television You have to motivate the cause as required by 188.4 for which the postponement is requested and you could not motivate it because you knew that the Minister of the Presidency would be you are present and that the Minister of Territorial Administration would be you are present to which you could have referred the question Look you guys,#party.Vox,Vox,ES,#orientation.RRF,M,42.751747,22.386414,14,question madam president denounce trapide government committing spanish radio television motivate cause required 188.4 postponement requested could motivate knew minister presidency would present minister territorial administration would present could referred question look guys
#MaríaTeresaLópezÁlvarez,"Thank you President I 'll tell you in a lower tone so Mr. Abascal does n't get infected I wish I had been because I was going to give him the reason but you can tell him I totally agree infinite distance We 're in the antepods at all You defend dictatorships and dictators we defend democracy and freedom Point I have nothing more to add Mrs. Gamarra I 've been listening to you attentively throughout the day and you seem to me to be inside a dystopic series in which everything has turned around and we are in the world backwards You have begun with a sofa and with all your stands intoxicated representatives of the only party condemned as a criminal plot organized by the delinquent And I do n't say it the sentence says it Would n't they be a little quiet Then he came with the typical cheap demagogy it is that the president has raised his salary Yeah You know what the president 's paying for do n't you Can you tell us what Mr. Feijoo is paid to compare because they have hidden it from everyone I mean live transparency and live the difference He then said that one thing was to take care of the institutions and another was to assault them as the Government did Can you tell me what it 's like to be four years out of line with the Constitution to continue controlling the judiciary Can you tell me what it is to try that what the citizens have not given you in the ballot box will be given to you by the close ones in the sentences because that will not be to assault the institutions but it looks a lot like occupying them anti-democraticly He later said that this Government had raised taxes and the President had already replied Look you say you 've received 27 billion more at the cost of inflation Already but more than 35,000 have been earmarked to help the citizens of this country By the way the debt this year in the budgets seems to be going to fall by 3 You tell me when you went up all the taxes cut all the benefits and increased the debt to what do you allocate the resources because you did not appear anywhere I told you before they cut and cut and everything was given to the banks And then the pensions Beyond the chatter in the only interview in which Feijóo has not gone in the peripheral phrases he said textually that he was against raising pensions with the CPI Point That 's right as it was hard to swallow then they wrapped this up by confronting the pensioners with the young people and saying it was n't sustainable But of course the solution for the right is always the same to cut pensions instead of looking at how to make the system sustainable the same as in the labour market where the only thing they do is to reduce layoffs and lower wages This is his recipe always to attack the most humble to sustain the wealth of a few And one thing to finish and this worries me very much that I will also say in a low tone You have said again here and they say it in every control session that this government cannot go out on the street What is he trying to say that a democratic government because you do n't like it ca n't go free on the street No no I 'll finish the reflection",#party.Vox,Vox,ES,#orientation.RRF,F,28.925737,22.729616,14,"thank president 'll tell lower tone mr. abascal n't get infected wish going give reason tell totally agree infinite distance 're antepods defend dictatorships dictators defend democracy freedom point nothing add mrs. gamarra 've listening attentively throughout day seem inside dystopic series everything turned around world backwards begun sofa stands intoxicated representatives party condemned criminal plot organized delinquent n't say sentence says would n't little quiet came typical cheap demagogy president raised salary yeah know president 's paying n't tell us mr. feijoo paid compare hidden everyone mean live transparency live difference said one thing take care institutions another assault government tell 's like four years line constitution continue controlling judiciary tell try citizens given ballot box given close ones sentences assault institutions looks lot like occupying anti-democraticly later said government raised taxes president already replied look say 've received 27 billion cost inflation already 35,000 earmarked help citizens country way debt year budgets seems going fall 3 tell went taxes cut benefits increased debt allocate resources appear anywhere told cut cut everything given banks pensions beyond chatter interview feijóo gone peripheral phrases said textually raising pensions cpi point 's right hard swallow wrapped confronting pensioners young people saying n't sustainable course solution right always cut pensions instead looking make system sustainable labour market thing reduce layoffs lower wages recipe always attack humble sustain wealth one thing finish worries much also say low tone said say every control session government cannot go street trying say democratic government n't like ca n't go free street 'll finish reflection"
