speaker_id,speeches,party_id,party_name,county,orientation,sex,x0,x1,cluster,speeches_cleaned
#MireiaBorrásPabón,"Good afternoon ladies and gentlemen Mr Echenique I imagine that from the coat of vision is said by your former advisor Podemos Cristóbal Gallego Councillor of Enagas who has charged almost 70,000 euros in just six months I guess he says so for him Turning to the question today we are discussing a proposal for a law of the communist group of the House which like any communist initiative is limited to urging state control of anything in this case of hydroelectric plants to create a public energy company called Spanish energy production I wish this government could move the water through Spain with the same looseness with which the water dances to the communists separatists and bildutaras in order to keep itself at all costs in power But as we have explained more often a public energy company is not the solution to high energy prices In their proposal for a law they state that direct management of the hydroelectric fleet through a public undertaking could solve the high price of the electricity bill That is literally what they say in their proposal Well this is simply a lie Perhaps it was the solution to put your friends and family in another little chiringuito I do n't doubt that but certainly not to lower the electric bill to the Spaniards Besides we have numerous examples it 's not something that says VOX We have many examples such as that of Italy with its public company paying an average price higher than in Spain or that of France where the Government has just announced a recapitalisation for more than EUR 2 billion due precisely to the economic difficulties of its public energy company or that of Mexico with very high electricity prices four blackouts in the last three years and its public energy company in technical bankruptcy But without going so far the public electricity of his fellow Kichi in Cadiz Eléctrica de Cadiz has been forced like any other private company to raise prices in order to avoid incurring losses Ladies and gentlemen the only difference between a public and a private enterprise is that the public is subject to the interests of politicians and the private to the interests of the market which we are all citizens of this country In addition a public energy company only ensures that costs and risks are borne by the money of all Spaniards and does not offer any added advantage to private management If today there was a public company composed of all the hydroelectric plants in Spain the price of energy would continue to set historical peaks every day Why Very simple because it would continue to operate in a regulated European market with the same rules for everyone regardless of whether management is public or private So gentlemen of Podemos stop diverting attention from the real problem which is you your political decisions and those of this government Those are the ones that have caused and continue to cause an increase in the price of energy and not the ownership of the companies that manage it Ladies and gentlemen what would happen if we had right now operating the nuclear power plants shut down by bipartisanism What would happen if we could continue to count in this energy crisis with the coal thermal power plants that you so hastened to shut down Do you think we'd be in this situation Well surely not And surely the reservoirs would not have been emptied by high electricity prices either The decision of the electricians to empty the reservoirs in summer has caused the water reserves to be already less than half when the average in the last ten years for these dates has always been more than 60 This is particularly worrying in southern Spain in communities such as Andalusia where they are only 30 or in Murcia 22 This situation is also exacerbated by the lack of infrastructure necessary to bring water to all regions and to co-ordinate the nation indeed by the repeal by the PSOE of the transfer of the Ebro in the National Hydrological Plan We know that companies have economic interests it is true which sometimes leads to neglect of other issues relating to the common good such as the environmental impact or economic activity and the way of life of the regions especially in rural Spain But what are the politicians for ladies and gentlemen Who is directly responsible for these reservoirs Who has allowed companies to empty them even if they can avoid it Hydrographic confederations And on whom do hydrographic confederations depend Lords of Podemos and Government Of the same public administration that for example authorized the emptying of reservoirs such as that of Ricobayo in Zamora or that of Valdecañas in Cáceres And we still have to listen to the government and the minister of energy ruin and demographic hell complaining about something that depends on their own ministry Amazing If the Administration is not even able to properly manage this irregular use so that companies do not exploit the reservoirs to this point how will they be able to ensure their optimal and efficient management They apply the same hypocrisy to everything as they sink this country They regret the unorthodox prices of energy while practicing a suicidal energy policy that attacks our energy sovereignty They close nuclear and coal plants in Spain and then import nuclear and coal energy from countries such as France and Morocco It would only be necessary for you gentlemen of the Government to talk about human rights by negotiating with terrorists Oh no I 'm sorry they 're already doing this They are the face of an unbearable cynicism with a president of the government who lands in Ciudad Real in a Super Puma helicopter which spends an average of 600 litres of kerosene at the hour to demand a green and renewable energy consumption from citizens who impoverish and ruin every day to supposedly combat climate change I 'm running out of adjectives for you ladies and gentlemen There is plenty of water for all the provinces in Spain and what we must do is to ensure that every drop reaches every corner of the country through a national hydrological plan Not only do we have to make sure that the wifi which comes too but it must first reach all regions In addition it should be reconsidered whether with the current energy mix water should continue to be devoted to electricity generation or whether it has greater value for other uses such as human agricultural tourism etc. which have no substitution and of course energy storage Make it clear and I will finish Madam President that in VOX we will not allow the rights of the Spaniards to be restricted by invoking their false and globalist Agenda 2030 We will promote through the interconnection of all the basins a green and prosperous Spain that guarantees industrial development compatible with the environmental sustainability and well being of all Spaniards",#party.Vox,Vox,ES,#orientation.RRF,F,44.797115,-4.4344673,34,"good afternoon ladies gentlemen mr echenique imagine coat vision said former advisor podemos cristóbal gallego councillor enagas charged almost 70,000 euros six months guess says turning question today discussing proposal law communist group house like communist initiative limited urging state control anything case hydroelectric plants create public energy company called spanish energy production wish government could move water spain looseness water dances communists separatists bildutaras order keep costs power explained often public energy company solution high energy prices proposal law state direct management hydroelectric fleet public undertaking could solve high price electricity bill literally say proposal well simply lie perhaps solution put friends family another little chiringuito n't doubt certainly lower electric bill spaniards besides numerous examples 's something says vox many examples italy public company paying average price higher spain france government announced recapitalisation eur 2 billion due precisely economic difficulties public energy company mexico high electricity prices four blackouts last three years public energy company technical bankruptcy without going far public electricity fellow kichi cadiz eléctrica de cadiz forced like private company raise prices order avoid incurring losses ladies gentlemen difference public private enterprise public subject interests politicians private interests market citizens country addition public energy company ensures costs risks borne money spaniards offer added advantage private management today public company composed hydroelectric plants spain price energy would continue set historical peaks every day simple would continue operate regulated european market rules everyone regardless whether management public private gentlemen podemos stop diverting attention real problem political decisions government ones caused continue cause increase price energy ownership companies manage ladies gentlemen would happen right operating nuclear power plants shut bipartisanism would happen could continue count energy crisis coal thermal power plants hastened shut think we'd situation well surely surely reservoirs would emptied high electricity prices either decision electricians empty reservoirs summer caused water reserves already less half average last ten years dates always 60 particularly worrying southern spain communities andalusia 30 murcia 22 situation also exacerbated lack infrastructure necessary bring water regions co-ordinate nation indeed repeal psoe transfer ebro national hydrological plan know companies economic interests true sometimes leads neglect issues relating common good environmental impact economic activity way life regions especially rural spain politicians ladies gentlemen directly responsible reservoirs allowed companies empty even avoid hydrographic confederations hydrographic confederations depend lords podemos government public administration example authorized emptying reservoirs ricobayo zamora valdecañas cáceres still listen government minister energy ruin demographic hell complaining something depends ministry amazing administration even able properly manage irregular use companies exploit reservoirs point able ensure optimal efficient management apply hypocrisy everything sink country regret unorthodox prices energy practicing suicidal energy policy attacks energy sovereignty close nuclear coal plants spain import nuclear coal energy countries france morocco would necessary gentlemen government talk human rights negotiating terrorists oh 'm sorry 're already face unbearable cynicism president government lands ciudad real super puma helicopter spends average 600 litres kerosene hour demand green renewable energy consumption citizens impoverish ruin every day supposedly combat climate change 'm running adjectives ladies gentlemen plenty water provinces spain must ensure every drop reaches every corner country national hydrological plan make sure wifi comes must first reach regions addition reconsidered whether current energy mix water continue devoted electricity generation whether greater value uses human agricultural tourism etc. substitution course energy storage make clear finish madam president vox allow rights spaniards restricted invoking false globalist agenda 2030 promote interconnection basins green prosperous spain guarantees industrial development compatible environmental sustainability well spaniards"
#MireiaBorrásPabón,Thank you President Good afternoon deputies This government has already managed to make us here today in this Chamber part of 10 of the Spaniards who can afford to have their home at a more or less decent temperature at a temperature comparable to that which we also have in this Chamber about 27 degrees 27 comfortable degrees which allow us to be here today in this Chamber practically in short sleeves We can be here practically in short sleeves while millions of Spaniards in their homes can't turn on the heating That is why you legislate as you legislate because you do not suffer the consequences of your ideological and sectarian policies it is the Spaniards who bear them Ladies and gentlemen we have gas deposits in Spain for over 40 years we have the world 's second largest uranium reserves we have in the Canary Islands the world 's largest deposits of telurium a key mineral for solar energy but what is the government doing The Government prohibited by law the exploitation of that gas the Government prohibited by law the exploitation of that uranium for nuclear energy and the Government de facto handed over the canary deposits to Moroccan expansionism How long does the megawatt hour have to come gentlemen of the government for you to react at once And by the way the gas that Spain will receive from the United States is the result of fracking which is forbidden in Spain also for you The energy we receive from France and Morocco produced with nuclear and coal is generated with the same power stations that you here today close and demonize every day And says the PSOE spokesman that we have to abandon fossil fuels as soon as possible Yeah to make a difference of course They want to abandon them to import them because they do not think enough of the energy dependence that we have already suffered in Spain 75 a tremendously high energy dependence and that because of this government we will be able to increase and worsen a dependence that impoverishes us and weakens us as a nation We are beating all the records ladies and gentlemen including the index of misery in the developed world where we already occupy the first place because with this government we have the highest inflation in our history the highest public debt in our history the most expensive bill of light in our history By the way are you also going to put all this in Pedro Sánchez 's new Netflix series I 'm sure you do are n't you But let 's talk about energy do n't let me sleep here with the summery temperature we have in the Chamber It is good to facilitate the development of hydrogen in Spain of course it improves and diversifys our energy sovereignty Making the most of all our resources strengthens us as a nation and it is also vital to put them at the service of Spain and the Spaniards to defend ours Because if we were to depend on our own ladies and gentlemen we would not be so foolish as to be the only country that by law prohibits the exploitation and research of its own resources wasting enormous productive potential causing a possible shortage of raw materials for industry and causing even more misery to all Spaniards If we depended on it this government would not be flying thermal power plants in the midst of an energy crisis to kneel down to climate fanaticism which threatens our rural world and our industry Sidef Let 's say ours ladies and gentlemen it will not give more than EUR 20 billion to its gender ideology while giving 20 cents per litre to our transporters who just want to work And above all we would not have reached this situation of national crisis to which all of you have led us How many demonstrations with almost half a million people need to start working and offer solutions to the Spaniards But of course all the protesters are now of the far right ladies and gentlemen now if you fight for your children 's bread this government points you to the ultra and the facha Do you know what kind of ultras we are in VOX We are ultras in demanding urgent solutions to the misery that you provoke we are ultras in demanding an immediate reduction of taxes on electricity and hydrocarbons and we are ultras in advancing our energy sovereignty and in ensuring the transparency of every public euro invested as we have already proposed in our amendments to which of course as VOX puts it you will vote against even if you are of full common sense And finally ladies and gentlemen the only shock plan that works in this country is for you to resign as a bloc and do it now Call for general elections now Thank you very much,#party.Vox,Vox,ES,#orientation.RRF,F,45.276085,-1.4406514,34,thank president good afternoon deputies government already managed make us today chamber part 10 spaniards afford home less decent temperature temperature comparable also chamber 27 degrees 27 comfortable degrees allow us today chamber practically short sleeves practically short sleeves millions spaniards homes can't turn heating legislate legislate suffer consequences ideological sectarian policies spaniards bear ladies gentlemen gas deposits spain 40 years world 's second largest uranium reserves canary islands world 's largest deposits telurium key mineral solar energy government government prohibited law exploitation gas government prohibited law exploitation uranium nuclear energy government de facto handed canary deposits moroccan expansionism long megawatt hour come gentlemen government react way gas spain receive united states result fracking forbidden spain also energy receive france morocco produced nuclear coal generated power stations today close demonize every day says psoe spokesman abandon fossil fuels soon possible yeah make difference course want abandon import think enough energy dependence already suffered spain 75 tremendously high energy dependence government able increase worsen dependence impoverishes us weakens us nation beating records ladies gentlemen including index misery developed world already occupy first place government highest inflation history highest public debt history expensive bill light history way also going put pedro sánchez 's new netflix series 'm sure n't let 's talk energy n't let sleep summery temperature chamber good facilitate development hydrogen spain course improves diversifys energy sovereignty making resources strengthens us nation also vital put service spain spaniards defend depend ladies gentlemen would foolish country law prohibits exploitation research resources wasting enormous productive potential causing possible shortage raw materials industry causing even misery spaniards depended government would flying thermal power plants midst energy crisis kneel climate fanaticism threatens rural world industry sidef let 's say ladies gentlemen give eur 20 billion gender ideology giving 20 cents per litre transporters want work would reached situation national crisis led us many demonstrations almost half million people need start working offer solutions spaniards course protesters far right ladies gentlemen fight children 's bread government points ultra facha know kind ultras vox ultras demanding urgent solutions misery provoke ultras demanding immediate reduction taxes electricity hydrocarbons ultras advancing energy sovereignty ensuring transparency every public euro invested already proposed amendments course vox puts vote even full common sense finally ladies gentlemen shock plan works country resign bloc call general elections thank much
