speaker_id,speeches,party_id,party_name,county,orientation,sex,x0,x1,cluster,speeches_cleaned
#JoséMaríaFigaredoÁlvarezSala,Minister your policy is so disastrous that it jumps to the alarms of the Congress of Deputies In your dogma minister as good heirs of the Spanish Socialist Workers Party you come with the lesson learned you have not stopped repeating I think up to seventeen times I have counted a Spanish card You repeat as a parrot the four ideas that draw you from the ministry The reality is that you are absolutely out of the world Minister I did n't say we had to grab the coal I did n't say You come twist the words and try to bring the arguments closer to your convenience Minister Spain and the Spanish need a prudent prudent energy mix Now we are faced with a situation that you described very well when you said that we depend on a single gas supplier that is Putin you are absolutely right and that is the policy of the European Commission and its successive governments in Spain That 's really the problem We cannot depend on a single supplier We need to diversify our energy sources as much as possible Spain has gas reserves to supply for forty three years and you in your ecological transition law even forbids exploring them So do n't come here and tell us Chinese stories because you are actually Chinese that you want us to have energy independence of any kind because the technology with which photovoltaic energy is generated comes from China energy dependence and the systems with which electric energy is generated by aerogeneration also have their ecological glues But you prefer to erase them because you dogmatically cling only to those two possible sources of energy The reality is that Spain and the Spaniards go on a boat all together and you for some lofty but dogmatic idea convinced us to burn or throw into the water all the lifeboats and suddenly something that was not in your schemes has caused that boat to sink What 's the surprise That Spain has no lifeboats because you carried out an energy policy for years absolutely irresponsible We must Madam Minister return to common sense we must Madam Minister rely on as many sources as possible that is diversification And if those sources can be extracted in Spain let 's do it but do n't close yourselves in the band for as I said mere ideology You 're talking about agriculture Madam Minister you in the CAP have established the obligation to receive European funds to put land on a beard They 've taken us to medieval farming techniques And you intend to tell us that we are old At the very least your Ministry for the Ecological Transition and the Demographic Challenge is medieval and that Minister runs counter to the interests of the Spanish You 're talking about swamps being in historical minima Madam Minister because you have authorized each and every one of the empty ones that have been produced all of them and this is important for the Spanish to understand and for you to stop lying to the Spanish Therefore please Minister prepare in accordance with Article 92 of the Constitution a public consultation on whether the Spaniards want their strategy harmful to the interests of Spain or whether on the contrary they prefer a reasonable strategy Renewable Yes but to the right extent and with patience because as much as you tighten the accelerator to the renewables what is going to happen is that the Spaniards are choking because we do not have the capacity today to assume the strategy that you intend to impose on us Please ask and let Spain decide whether it wants its climate crazy or wants common sense reasonable energy prices energy available to all Spaniards and energy that depends on ourselves Ask the Spaniards Thank you so much,#party.Vox,Vox,ES,#orientation.RRF,M,44.75632,-2.251189,34,minister policy disastrous jumps alarms congress deputies dogma minister good heirs spanish socialist workers party come lesson learned stopped repeating think seventeen times counted spanish card repeat parrot four ideas draw ministry reality absolutely world minister n't say grab coal n't say come twist words try bring arguments closer convenience minister spain spanish need prudent prudent energy mix faced situation described well said depend single gas supplier putin absolutely right policy european commission successive governments spain 's really problem cannot depend single supplier need diversify energy sources much possible spain gas reserves supply forty three years ecological transition law even forbids exploring n't come tell us chinese stories actually chinese want us energy independence kind technology photovoltaic energy generated comes china energy dependence systems electric energy generated aerogeneration also ecological glues prefer erase dogmatically cling two possible sources energy reality spain spaniards go boat together lofty dogmatic idea convinced us burn throw water lifeboats suddenly something schemes caused boat sink 's surprise spain lifeboats carried energy policy years absolutely irresponsible must madam minister return common sense must madam minister rely many sources possible diversification sources extracted spain let 's n't close band said mere ideology 're talking agriculture madam minister cap established obligation receive european funds put land beard 've taken us medieval farming techniques intend tell us old least ministry ecological transition demographic challenge medieval minister runs counter interests spanish 're talking swamps historical minima madam minister authorized every one empty ones produced important spanish understand stop lying spanish therefore please minister prepare accordance article 92 constitution public consultation whether spaniards want strategy harmful interests spain whether contrary prefer reasonable strategy renewable yes right extent patience much tighten accelerator renewables going happen spaniards choking capacity today assume strategy intend impose us please ask let spain decide whether wants climate crazy wants common sense reasonable energy prices energy available spaniards energy depends ask spaniards thank much
#JoséMaríaFigaredoÁlvarezSala,Thank you so much Very good afternoon now I will intervene a little quickly because we have many issues to deal with that are relatively complex We are talking about the validation of a real decree law presented to us by the Minister of Ecological Transition which is a complex decree of those who mix barbecues with merinas as always does the Socialist Party they make a very complex cocktail with measures ranging from an extension of the deadlines to request an exemption in the obligation to pay certain commissions and financial interests they give an extension by the way because the system created by the Socialist Party is so highly complex and bureaucratic that not even 2 of potential applicants have been able to fill out the forms that is they give an extension for their own cogeneration to the question of cogeneration It is important that we all understand what cogeneration is a technology that generates heat and with that heat that it produces it also generates electrical energy It is very good for those industries that need heat such as the paper industry or the ceramic industry They put in a cogeneration plant they produce their heat they also produce electrical energy that they convert to the system and sell it in a very concrete regulated system and so they pay for a part of that heat that they need It is a very efficient system and works very well but it has a problem that the Socialist Party invents a mechanism to subsidize gas and excludes cogeneration plants What 's wrong with this It 's priceless What happens when they 're out of price They have to shut down the cogeneration plant The minister in an absolutely incomprehensible speech in which of course mixes concepts of one type and another does not tell us that when a cogeneration plant closes it closes the industry to which this plant feeds Thus it has happened that this summer they have gone to Castellónquinientos and peak workers to the street because of your fault minister In Asturias they are depending on a thread in the area of Navia two hundred and peak jobs because of your fault minister In Pontevedra there 's a trash can that 's about to close Finally they put cogeneration into this royal decree and also put a VAT rebate on the gas bill but as a previous spokesman has said they do not put a rebate on the butane candy which is the most basic good of these gas related products They do not include it that must be rich and there the VAT is not reduced The reduction in VAT brought to us by the Government is a real insult because it proposes a reduction in VAT for October November and December Is it not going to be cold on January 1st On 1 January there is no longer a problem that is the VAT reduction is until 31 December and from 31 December everything is perfect And it is that we find that the Government is covering its cods with new cods with new cods and with new cods Always with temporary resolutions and small patches instead of attacking the substantial issue instead of solving the problem What 's the problem The problem Minister is that you and the previous governments have thrown us into a suicidal energy policy for thirty years We 've put all the eggs in one basket and now all of a sudden that basket is broken That basket is gas and renewables Mr. De Podemos postin ecologist denies with his head Now I 'll explain to you what Podemos proposes Madam Minister we have thrown ourselves into an energy race in which we have made ourselves dependent on one product What happens now That this product weakens and therefore Spain enters into crisis What does VOX propose For VOX proposes energy sovereignty which in all we can Minister we depend on ourselves From ourselves much or little but if we can take a little advantage of the energy we have here let 's take advantage of it And the Lord of Podemos comes and tells us his battles and his films and says renewable only renewable and nothing but renewable and the gas is fatal And it shows me a survey Who answered that survey He says that ninety six percent of young Spaniards What young Spaniards Who answered that The slums that chase you around all day Who voted that Greta Thunberg whining Mehan stole childhood Greta Thunberg who has lived a systematic life of luxury These people vote for those issues Who voted that Those young girls who said chickens were being raped by cocks Those are the ones who voted for Podemos 's crazy poll Yes yes it teaches me a cheese rosita by the way of the color of Podemos The reality gentlemen is that Spain has embarked on a crazy career in its energy strategy You speak gentlemen of Podemos of renewable energy which is very good but it is that for all of us to understand each other Spain has an installed wind power of around 30 gigas and in the last year there have been six Spain has a solar power of around 20 gigas and in the last year there have been an average of 4 Why Because the sun does n't shine twenty four hours a day and the wind does n't blow twenty four hours a day What happens when the wind does n't blow and the sun does n't shine That we need what is called a back up energy and thank you or because of you the only back up energy that Spain has today is gas Because of him We used to have coal we had a good nuclear plant and we had hydraulic power which you do n't like either In short we had many cards in our deck we could play according to which one had a better or a worse price but because of their strategies Socialist Party and We Can we are totally sold That is why if a community of standard owners of Spain which by the way are outside their gas mechanisms that is the Spanish families the Spanish little one on foot are outside their gas subsidy mechanisms which only apply to the industry which is not bad but apply it to everyone it was paying about 200 euros per floor of community cost it has now been put at around 400 euros The cost to families has almost doubled for energy and I am talking about the typical standard community in Madrid that has a heating agas heating that by the way was previously coal and you forced to change the gas putting them in front of this sword of Damocles that is now going to cut off their heads In short like so many times the government places a hook a trap for the Spaniards and puts a small bait on it Minister stop cheating on Spain and please take the necessary steps to resolve this crisis Get us out of the marginalist market just like they 're going to get Spain out of the Energy Charter Convention Thank you so much,#party.Vox,Vox,ES,#orientation.RRF,M,40.701843,-6.2928114,34,thank much good afternoon intervene little quickly many issues deal relatively complex talking validation real decree law presented us minister ecological transition complex decree mix barbecues merinas always socialist party make complex cocktail measures ranging extension deadlines request exemption obligation pay certain commissions financial interests give extension way system created socialist party highly complex bureaucratic even 2 potential applicants able fill forms give extension cogeneration question cogeneration important understand cogeneration technology generates heat heat produces also generates electrical energy good industries need heat paper industry ceramic industry put cogeneration plant produce heat also produce electrical energy convert system sell concrete regulated system pay part heat need efficient system works well problem socialist party invents mechanism subsidize gas excludes cogeneration plants 's wrong 's priceless happens 're price shut cogeneration plant minister absolutely incomprehensible speech course mixes concepts one type another tell us cogeneration plant closes closes industry plant feeds thus happened summer gone castellónquinientos peak workers street fault minister asturias depending thread area navia two hundred peak jobs fault minister pontevedra 's trash 's close finally put cogeneration royal decree also put vat rebate gas bill previous spokesman said put rebate butane candy basic good gas related products include must rich vat reduced reduction vat brought us government real insult proposes reduction vat october november december going cold january 1st 1 january longer problem vat reduction 31 december 31 december everything perfect find government covering cods new cods new cods new cods always temporary resolutions small patches instead attacking substantial issue instead solving problem 's problem problem minister previous governments thrown us suicidal energy policy thirty years 've put eggs one basket sudden basket broken basket gas renewables mr. de podemos postin ecologist denies head 'll explain podemos proposes madam minister thrown energy race made dependent one product happens product weakens therefore spain enters crisis vox propose vox proposes energy sovereignty minister depend much little take little advantage energy let 's take advantage lord podemos comes tells us battles films says renewable renewable nothing renewable gas fatal shows survey answered survey says ninety six percent young spaniards young spaniards answered slums chase around day voted greta thunberg whining mehan stole childhood greta thunberg lived systematic life luxury people vote issues voted young girls said chickens raped cocks ones voted podemos 's crazy poll yes yes teaches cheese rosita way color podemos reality gentlemen spain embarked crazy career energy strategy speak gentlemen podemos renewable energy good us understand spain installed wind power around 30 gigas last year six spain solar power around 20 gigas last year average 4 sun n't shine twenty four hours day wind n't blow twenty four hours day happens wind n't blow sun n't shine need called back energy thank back energy spain today gas used coal good nuclear plant hydraulic power n't like either short many cards deck could play according one better worse price strategies socialist party totally sold community standard owners spain way outside gas mechanisms spanish families spanish little one foot outside gas subsidy mechanisms apply industry bad apply everyone paying 200 euros per floor community cost put around 400 euros cost families almost doubled energy talking typical standard community madrid heating agas heating way previously coal forced change gas putting front sword damocles going cut heads short like many times government places hook trap spaniards puts small bait minister stop cheating spain please take necessary steps resolve crisis get us marginalist market like 're going get spain energy charter convention thank much
#JoséMaríaFigaredoÁlvarezSala,Thank you very much Mr President The Group of the European People 's Party is bringing us an initiative that announces seemingly sharp support for Spanish industry and a very important part of this initiative does have an acceptable content we could say that 75 of the initiative but another 25 is totally unacceptable and I will explain This 25 which is a full section of the initiative is entitled Protocol for the decarbonisation with capitalization of the de of the Spanish industry And we must start by asking ourselves if we like industry if we want Spain to have a strong industry it is important that we all ask ourselves because although it seems like a pergrullada the answer in both parties of the alternation is probably not or at least not so much and I will explain myself The climate issue and energy are closely related as everyone knows Indeed energy is one of the industry 's main inputs as well as having a strong impact on the climate issue as the industry emits the so called CO2 and I explain myself CO2 costs are an administrative cost To get an idea from those who listen to us a steel producing steel company in Spain will sell every tonne of steel about 700 euros and will have to pay for its CO2 emissions up to about 132 euros Do you guys realize that They represent approximately 15 of the final product price of CO2 emissions regardless of the costs of CO2 included in energy production We 're still talking about gasoline diesel and so on The State imposes taxes representing 50 of the final price of petrol and diesel If there is now petrol at 2 euros one euro is taken directly by the Administration between VAT excise duties excise duties on the value added of the product etc And yet they attack these forms of energy and beat other potential forms of energy that we could have in Spain Think about fracking oil in the Canary Islands nuclear energy etc And why do they do it Because they do n't like the industry so much The reality is that all they are doing is putting the industry one after the other and the most obvious example we have in regulating CO2 emissions to car production The European Union drew up a first regulation in 2007 In 2009 they tighten and demand fewer emissions punish them more another regulation In 2011 another in 2015 another in 2017 another And in 2021 with the approval of the Fit for 55 plan they ended up giving the industry the blow of grace All this within these protocols for the decarbonisation of industry that the People 's Party introduces in this initiative which supposedly seeks to support industry You 'll think should CO2 emissions be moderated Of course we must be moderated of course but what makes no sense is what they are doing in the alternation of parties because they have both done so whenever they have ruled You see that from 2007 to 2021 both have ruled and both have been accentuating the demands for our industry and the situation is that the industry is disappearing in Spain You yourselves gentlemen of the People 's Party introduce measures that wear it down and attack it in initiatives that you supposedly intend to support because you have abandoned the workers Both are traitors they have abandoned the workers they have abandoned the industry and they have abandoned the sector The proof is that all milk production in Spain is disappearing precisely because of energy costs Fisheries in Spain are in danger of extinction precisely or among other things of energy costs Let us not talk about the steel industry or the car industry In short industry is in danger of extinction by the policies that you two traitors have been imposing one after the other And today the People 's Party to supposedly support the industry introduces a new twist of thread to these policies,#party.Vox,Vox,ES,#orientation.RRF,M,44.5497,-3.6109939,34,thank much mr president group european people 's party bringing us initiative announces seemingly sharp support spanish industry important part initiative acceptable content could say 75 initiative another 25 totally unacceptable explain 25 full section initiative entitled protocol decarbonisation capitalization de spanish industry must start asking like industry want spain strong industry important ask although seems like pergrullada answer parties alternation probably least much explain climate issue energy closely related everyone knows indeed energy one industry 's main inputs well strong impact climate issue industry emits called co2 explain co2 costs administrative cost get idea listen us steel producing steel company spain sell every tonne steel 700 euros pay co2 emissions 132 euros guys realize represent approximately 15 final product price co2 emissions regardless costs co2 included energy production 're still talking gasoline diesel state imposes taxes representing 50 final price petrol diesel petrol 2 euros one euro taken directly administration vat excise duties excise duties value added product etc yet attack forms energy beat potential forms energy could spain think fracking oil canary islands nuclear energy etc n't like industry much reality putting industry one obvious example regulating co2 emissions car production european union drew first regulation 2007 2009 tighten demand fewer emissions punish another regulation 2011 another 2015 another 2017 another 2021 approval fit 55 plan ended giving industry blow grace within protocols decarbonisation industry people 's party introduces initiative supposedly seeks support industry 'll think co2 emissions moderated course must moderated course makes sense alternation parties done whenever ruled see 2007 2021 ruled accentuating demands industry situation industry disappearing spain gentlemen people 's party introduce measures wear attack initiatives supposedly intend support abandoned workers traitors abandoned workers abandoned industry abandoned sector proof milk production spain disappearing precisely energy costs fisheries spain danger extinction precisely among things energy costs let us talk steel industry car industry short industry danger extinction policies two traitors imposing one today people 's party supposedly support industry introduces new twist thread policies
